Date,Time,Title,URL,Type,Ticker
2020-08-31,,Сбербанк. Бумага вновь уступила первое место по оборотам Яндексу,https://bcs-express.ru/tehanaliz/sber/31.08.20,Теханализ,SBER
2020-08-28,,Сбербанк. Усугубили ситуацию,https://bcs-express.ru/tehanaliz/sber/28.08.20,Теханализ,SBER
2020-08-27,,"Сбербанк. Плечи узкие, но голова большая",https://bcs-express.ru/tehanaliz/sber/27.08.20,Теханализ,SBER
2020-08-26,,А если завтра обвал…,https://bcs-express.ru/novosti-i-analitika/a-esli-zavtra-obval,Среднесрочные тренды,SBER
2020-08-26,,Сбербанк. Пробой 224 ухудшит среднесрочные перспективы,https://bcs-express.ru/tehanaliz/sber/26.08.20,Теханализ,SBER
2020-08-25,,Сбербанк. Финсектор не в чести,https://bcs-express.ru/tehanaliz/sber/25.08.20,Теханализ,SBER
2020-08-24,,Сбербанк. Эмоциональная реакция на дивиденды,https://bcs-express.ru/tehanaliz/sber/24.08.20,Теханализ,SBER
2020-08-21,,Сбербанк наконец-то определился с дивидендами,https://bcs-express.ru/novosti-i-analitika/aktsii-sberbanka-vyshli-v-plius-na-novostiakh-o-dividendakh,Российский рынок,SBER
2020-08-21,,Сбербанк. Пробой августовского тренда не пугает,https://bcs-express.ru/tehanaliz/sber/21.08.20,Теханализ,SBER
2020-08-20,,Сбербанк. Риски отката к августовскому тренду сохраняются,https://bcs-express.ru/tehanaliz/sber/20.08.20,Теханализ,SBER
2020-08-19,,Набсовет Сбербанка 21 августа определится с дивидендами. Что ждать,https://bcs-express.ru/novosti-i-analitika/nabsovet-sberbanka-primet-reshenie-po-dividendam-21-avgusta,Дивиденды,SBER
2020-08-19,,Сбербанк. Четвертый день коррекции,https://bcs-express.ru/tehanaliz/sber/19.08.20,Теханализ,SBER
2020-08-18,,"Сбербанк. Не очень технично, но ожидаемо",https://bcs-express.ru/tehanaliz/sber/18.08.20,Теханализ,SBER
2020-08-17,,Сбербанк. Безболезненная разгрузка перекупленности,https://bcs-express.ru/tehanaliz/sber/17.08.20,Теханализ,SBER
2020-08-14,,Сбербанк. Ожидаемая фиксация,https://bcs-express.ru/tehanaliz/sber/14.08.20,Теханализ,SBER
2020-08-13,,"Сбербанк. Цели флага отработаны, бумага перекуплена",https://bcs-express.ru/tehanaliz/sber/13.08.20,Теханализ,SBER
2020-08-12,,Сбербанк. Цели бычьего флага пока вызывают сомнения,https://bcs-express.ru/tehanaliz/sber/12.08.20,Теханализ,SBER
2020-08-11,,Сбербанк. Внешний фон позволяет рассчитывать на штурм максимумов,https://bcs-express.ru/tehanaliz/sber/11.08.20,Теханализ,SBER
2020-08-10,,Сбербанк. Неделя закончилась бычьем поглощением,https://bcs-express.ru/tehanaliz/sber/10.08.20,Теханализ,SBER
2020-08-07,,Чистая прибыль Сбербанка в июле снизилась на 13%,https://bcs-express.ru/novosti-i-analitika/chistaia-pribyl-sberbanka-v-iiule-snizilas-na-13,Российский рынок,SBER
2020-08-07,,Сбербанк. Третьего штурма поддержка может не выдержать,https://bcs-express.ru/tehanaliz/sber/07.08.20,Теханализ,SBER
2020-08-06,,Сбербанк. Оказались под давлением,https://bcs-express.ru/tehanaliz/sber/06.08.20,Теханализ,SBER
2020-08-05,,"Сбербанк. Негативный сигнал будет получен с пробоем уровня 225,6",https://bcs-express.ru/tehanaliz/sber/05.08.20,Теханализ,SBER
2020-08-04,,Сбербанк. Может дотянуться до целей на уровнях 230–232,https://bcs-express.ru/tehanaliz/sber/04.08.20,Теханализ,SBER
2020-08-03,,Сбербанк. Получили позитивный сигнал под конец июля,https://bcs-express.ru/tehanaliz/sber/03.08.20,Теханализ,SBER
2020-07-31,,Сбербанку пора обновить июньские максимумы,https://bcs-express.ru/novosti-i-analitika/sberbanku-pora-obnovit-iiun-skie-maksimumy,Торговые рекомендации*,SBER
2020-07-31,,Сбербанк. В боковике и не такое бывает,https://bcs-express.ru/tehanaliz/sber/31.07.20,Теханализ,SBER
2020-07-31,,В Сбербанке прокомментировали перспективы дивидендов,https://bcs-express.ru/novosti-i-analitika/v-sberbanke-prokommentirovali-perspektivy-dividendov,Российский рынок,SBER
2020-07-30,,Сбербанк отчитался за II квартал. Что с чистой прибылью,https://bcs-express.ru/novosti-i-analitika/sberbank-otchitalsia-za-ii-kvartal-chto-s-chistoi-pribyl-iu,Российский рынок,SBER
2020-07-30,,Сбербанк. Готовы к выходу на максимумы июня,https://bcs-express.ru/tehanaliz/sber/30.07.20,Теханализ,SBER
2020-07-29,,Сбербанк. Шестой день стоит у 200-дневной средней,https://bcs-express.ru/tehanaliz/sber/29.07.20,Теханализ,SBER
2020-07-28,,Сбербанк. Выглядели слабо среди финансового сектора,https://bcs-express.ru/tehanaliz/sber/28.07.20,Теханализ,SBER
2020-07-27,,Сбербанк. Отбросил хвост,https://bcs-express.ru/tehanaliz/sber/27.07.20,Теханализ,SBER
2020-07-24,,"Сбербанк. Может удержаться на поддержках в районе 213–213,5",https://bcs-express.ru/tehanaliz/sber/24.07.20,Теханализ,SBER
2020-07-22,,Сбербанк. Разворотная свеча не пугает,https://bcs-express.ru/tehanaliz/sber/22.07.20,Теханализ,SBER
2020-07-21,,"Сбербанк. Пробили 1,5-месячный нисходящий тренд",https://bcs-express.ru/tehanaliz/sber/21.07.20,Теханализ,SBER
2020-07-21,,Кризисный «суборд» Сбербанка может войти в основной капитал,https://bcs-express.ru/novosti-i-analitika/krizisnyi-subord-sberbanka-mozhet-voiti-v-osnovnoi-kapital,Российский рынок,SBER
2020-07-20,,Сбербанк. Движение должно ускориться,https://bcs-express.ru/tehanaliz/sber/20.07.20,Теханализ,SBER
2020-07-17,,Сбербанк. Пора штурмовать нисходящий тренд,https://bcs-express.ru/tehanaliz/sber/17.07.20,Теханализ,SBER
2020-07-16,,Сбербанк. Просадки выкупаются. Нужно пробивать отметку 213,https://bcs-express.ru/tehanaliz/sber/16.07.20,Теханализ,SBER
2020-07-15,,Индекс стабильности дивидендов. Как считается и чем полезен,https://bcs-express.ru/novosti-i-analitika/indeks-stabil-nosti-dividendov-kak-schitaetsia-i-chem-polezen,Обучение,SBER
2020-07-15,,Сбербанк. Никто не хотел уступать,https://bcs-express.ru/tehanaliz/sber/15.07.20,Теханализ,SBER
2020-07-14,,Сбербанк. Месячный нисходящий тренд дал отпор,https://bcs-express.ru/tehanaliz/sber/14.07.20,Теханализ,SBER
2020-07-13,,Сбербанк. Бычье поглощение на дневном графике,https://bcs-express.ru/tehanaliz/sber/13.07.20,Теханализ,SBER
2020-07-10,,Сбербанк. Пробили линию шеи,https://bcs-express.ru/tehanaliz/sber/10.07.20,Теханализ,SBER
2020-07-09,,"SberPay приходит, PayPal уходит",https://bcs-express.ru/novosti-i-analitika/sberpay-prikhodit-paypal-ukhodit,Мировые рынки,SBER
2020-07-09,,Сбербанк. Давно не появлялась фигура Голова-плечи,https://bcs-express.ru/tehanaliz/sber/09.07.20,Теханализ,SBER
2020-07-08,,Сбербанк снизил прибыль на 17% в июне,https://bcs-express.ru/novosti-i-analitika/sberbank-snizil-pribyl-na-17-v-iiune,Российский рынок,SBER
2020-07-08,,"Сбербанк. Важный негативный сигнал получим в случае ухода ниже 206,5",https://bcs-express.ru/tehanaliz/sber/08.07.20,Теханализ,SBER
2020-07-07,,Сбербанк. Уровни 211–212 становятся опорными,https://bcs-express.ru/tehanaliz/sber/07.07.20,Теханализ,SBER
2020-07-06,,Сбербанк. Повторный штурм уровня 212 может стать успешным,https://bcs-express.ru/tehanaliz/sber/06.07.20,Теханализ,SBER
2020-07-03,,Сбербанк. Хорошее начало квартала,https://bcs-express.ru/tehanaliz/sber/03.07.20,Теханализ,SBER
2020-07-03,,"Минфин ждет от Сбербанка, ВТБ и Транснефти 50% прибыли на дивиденды",https://bcs-express.ru/novosti-i-analitika/minfin-zhdet-ot-sberbanka-vtb-i-transnefti-50-pribyli-na-dividendy,Российский рынок,SBER
2020-07-02,,Сбербанк вновь снизил ставки по рублевым вкладам,https://bcs-express.ru/novosti-i-analitika/sberbank-vnov-snizil-stavki-po-rublevym-vkladam,Новости,SBER
2020-07-02,,Сбербанк. -20% за полгода,https://bcs-express.ru/tehanaliz/sber/02.07.20,Теханализ,SBER
2020-06-30,,Сбербанк. Греф подбодрил под конец полугодия,https://bcs-express.ru/tehanaliz/sber/30.06.20,Теханализ,SBER
2020-06-29,,Сбербанк. Точно заплатим хорошие дивиденды,https://bcs-express.ru/novosti-i-analitika/sberbank-tochno-zaplatim-khoroshie-dividendy,Российский рынок,SBER
2020-06-29,,Сбербанк. Оптимизм улетучивается,https://bcs-express.ru/tehanaliz/sber/29.06.20,Теханализ,SBER
2020-06-25,,Сбербанк. Покупка от 200 руб.,https://bcs-express.ru/novosti-i-analitika/sberbank-pokupka-ot-200-rub,Торговые рекомендации*,SBER
2020-06-25,,"Сбербанк. Поддержка в районе 202,3 выдержит первый штурм",https://bcs-express.ru/tehanaliz/sber/25.06.20,Теханализ,SBER
2020-06-24,,Яндекс разделит активы со Сбербанком и выпустит новые акции,https://bcs-express.ru/novosti-i-analitika/iandeks-razdelit-aktivy-so-sberbankom-i-provedet-dopemissiiu,Российский рынок,SBER
2020-06-23,,Сбербанк. Первая вечерняя сессия прошла в боковике,https://bcs-express.ru/tehanaliz/sber/23.06.20,Теханализ,SBER
2020-06-22,,Сбербанк. До среды может постоять в диапазоне 202–212,https://bcs-express.ru/tehanaliz/sber/22.06.20,Теханализ,SBER
2020-06-19,,Самые «беспокойные» голубые фишки МосБиржи,https://bcs-express.ru/novosti-i-analitika/samye-bespokoinye-golubye-fishki-mosbirzhi,Среднесрочные тренды,SBER
2020-06-19,,Сбербанк. Пробой месячного тренда дает негативный сигнал,https://bcs-express.ru/tehanaliz/sber/19.06.20,Теханализ,SBER
2020-06-18,,Сбербанк. Пойдет на штурм месячного тренда,https://bcs-express.ru/tehanaliz/sber/18.06.20,Теханализ,SBER
2020-06-17,,Сбербанк. Гэп закрыли. Какие варианты дальнейшего движения,https://bcs-express.ru/tehanaliz/sber/17.06.20,Теханализ,SBER
2020-06-16,,Сбербанк. Пора восстанавливаться,https://bcs-express.ru/tehanaliz/sber/16.06.20,Теханализ,SBER
2020-06-15,,Сбербанк. И не пытались закрыть гэп,https://bcs-express.ru/tehanaliz/sber/15.06.20,Теханализ,SBER
2020-06-11,,Сбербанк приобретает долю в 2ГИС,https://bcs-express.ru/novosti-i-analitika/sberbank-priobretaet-doliu-v-2gis,Российский рынок,SBER
2020-06-11,,Сбербанк. Пробой восходящего тренда открыл дорогу коррекции,https://bcs-express.ru/tehanaliz/sber/11.06.20,Теханализ,SBER
2020-06-10,,Сбербанк. Осада двухнедельного восходящего тренда,https://bcs-express.ru/tehanaliz/sber/10.06.20,Теханализ,SBER
2020-06-09,,Сбербанк. Отработали сигналы медвежьей дивергенции,https://bcs-express.ru/tehanaliz/sber/09.06.20,Теханализ,SBER
2020-06-08,,Сбербанк. Быстро восстановились после коррекции,https://bcs-express.ru/tehanaliz/sber/08.06.20,Теханализ,SBER
2020-06-05,,Чистая прибыль Сбербанка в мае снизилась на 40%,https://bcs-express.ru/novosti-i-analitika/chistaia-pribyl-sberbanka-v-aprele-upala-na-85-iz-za-rosta-rezervov,Российский рынок,SBER
2020-06-05,,Сбербанк. Ожидаемо пошли вниз,https://bcs-express.ru/tehanaliz/sber/05.06.20,Теханализ,SBER
2020-06-04,,Cбербанк ведет переговоры о покупке 30% Ozon. Акции Системы растут на 5%,https://bcs-express.ru/novosti-i-analitika/cberbank-vedet-peregovory-o-pokupke-30-aktsii-ozon,Российский рынок,SBER
2020-06-04,,Сбербанк. Отыграно и перекуплено,https://bcs-express.ru/tehanaliz/sber/04.06.20,Теханализ,SBER
2020-06-03,,Сбербанк в лидерах роста. Акции подскочили на 4%,https://bcs-express.ru/novosti-i-analitika/sberbank-v-liderakh-rosta-aktsii-podskochili-na-4,Российский рынок,SBER
2020-06-03,,Сбербанк. Ждем еще один рывок перед откатом,https://bcs-express.ru/tehanaliz/sber/03.06.20,Теханализ,SBER
2020-06-02,,"Сбербанк. Обновили апрельские максимумы, можно идти дальше",https://bcs-express.ru/tehanaliz/sber/02.06.20,Теханализ,SBER
2020-06-01,,Сбербанк. Можно продолжать рост,https://bcs-express.ru/tehanaliz/sber/01.06.20,Теханализ,SBER
2020-05-29,,"Акции банковского сектора под давлением, но это временно",https://bcs-express.ru/novosti-i-analitika/bankovskii-sektor-pod-davleniem-no-eto-vremenno,Российский рынок,SBER
2020-05-29,,Сбербанк. Дальше без коррекции подниматься сложно,https://bcs-express.ru/tehanaliz/sber/29.05.20,Теханализ,SBER
2020-05-27,,Сбербанк. Еще есть шанс,https://bcs-express.ru/tehanaliz/sber/27.05.20,Теханализ,SBER
2020-05-26,,"Сбербанк. Картина была слабая, но продавцы не усилили давление",https://bcs-express.ru/tehanaliz/sber/26.05.20,Теханализ,SBER
2020-05-25,,Сбербанк. Риски дальнейшего снижения сохраняются,https://bcs-express.ru/tehanaliz/sber/25.05.20,Теханализ,SBER
2020-05-22,,Сбербанк. Теперь вниз,https://bcs-express.ru/tehanaliz/sber/22.05.20,Теханализ,SBER
2020-05-21,,Сбербанк. Это было неожиданно,https://bcs-express.ru/tehanaliz/sber/21.05.20,Теханализ,SBER
2020-05-20,,"Сбербанк. Может вернуться к 182–183,5",https://bcs-express.ru/tehanaliz/sber/20.05.20,Теханализ,SBER
2020-05-19,,"Сбербанк перенес решение по дивидендам, акции падают",https://bcs-express.ru/novosti-i-analitika/sberbank-perenes-reshenie-po-dividendam,Российский рынок,SBER
2020-05-19,,Сбербанк. Важный день календаря,https://bcs-express.ru/tehanaliz/sber/19.05.20,Теханализ,SBER
2020-05-18,,"Сбербанк. Слабовато, но внешний фон дает второй шанс",https://bcs-express.ru/tehanaliz/sber/18.05.20,Теханализ,SBER
2020-05-15,,Сбербанк. Отыграем бычьи сигналы,https://bcs-express.ru/tehanaliz/sber/15.05.20,Теханализ,SBER
2020-05-14,,Сбербанк. Цели смещаются к 182–183,https://bcs-express.ru/tehanaliz/sber/14.05.20,Теханализ,SBER
2020-05-13,,Чистая прибыль Сбербанка в апреле упала почти в семь раз,https://bcs-express.ru/novosti-i-analitika/chistaia-pribyl-sberbanka-v-aprele-upala-pochti-v-sem-raz,Российский рынок,SBER
2020-05-13,,Сбербанк. Высокий риск выхода вниз из треугольника,https://bcs-express.ru/tehanaliz/sber/13.05.20,Теханализ,SBER
2020-05-12,,Сбербанк. Пробой пятничных минимумов будет негативным сигналом,https://bcs-express.ru/tehanaliz/sber/12.05.20,Теханализ,SBER
2020-05-08,,Сбербанк. Разворотная свеча у границы треугольника снижает оптимизм,https://bcs-express.ru/tehanaliz/sber/08.05.20,Теханализ,SBER
2020-05-07,,ЦБ и Минфин установили минимальный размер дивидендов Сбербанка в 50% от прибыли,https://bcs-express.ru/novosti-i-analitika/tsb-i-minfin-ustanovili-minimal-nyi-razmer-dividendov-sberbanka-v-50-ot-pribyli,Российский рынок,SBER
2020-05-07,,Сбербанк. Границы консолидации стали еще ближе,https://bcs-express.ru/tehanaliz/sber/07.05.20,Теханализ,SBER
2020-05-06,,Сбербанк. В треугольнике надолго не задержится,https://bcs-express.ru/tehanaliz/sber/06.05.20,Теханализ,SBER
2020-05-05,,Сбербанк. Внешний фон и 200-я средняя могут поддержать инструмент,https://bcs-express.ru/tehanaliz/sber/05.05.20,Теханализ,SBER
2020-05-04,,Сбербанк. Ждем провала котировок на открытии,https://bcs-express.ru/tehanaliz/sber/04.05.20,Теханализ,SBER
2020-04-30,,Чистая прибыль Сбербанка упала почти вдвое в I квартале,https://bcs-express.ru/novosti-i-analitika/chistaia-pribyl-sberbanka-upala-pochti-vdvoe-v-i-kvartale,Российский рынок,SBER
2020-04-30,,Сбербанк. Может выйти к 200 до конца недели,https://bcs-express.ru/tehanaliz/sber/30.04.20,Теханализ,SBER
2020-04-29,,Сбербанк. Покупатели не отступят,https://bcs-express.ru/tehanaliz/sber/29.04.20,Теханализ,SBER
2020-04-28,,Сбербанк. Из треугольника может выйти с ложным пробоем,https://bcs-express.ru/tehanaliz/sber/28.04.20,Теханализ,SBER
2020-04-27,,"Сбербанк. Покупатели получат позитивный сигнал с пробоем 192,7",https://bcs-express.ru/tehanaliz/sber/27.04.20,Теханализ,SBER
2020-04-24,,Сбербанк. Штурм сопротивлений был безуспешным,https://bcs-express.ru/tehanaliz/sber/24.04.20,Теханализ,SBER
2020-04-23,,"Сбербанк. Следующим сигналом к росту будет пробой уровней 192–192,7",https://bcs-express.ru/tehanaliz/sber/23.04.20,Теханализ,SBER
2020-04-22,,Сбербанк. Риски движения к 182 сохраняются,https://bcs-express.ru/tehanaliz/sber/22.04.20,Теханализ,SBER
2020-04-21,,Сбербанк. Продолжит движение к нижней границе среднесрочного боковика,https://bcs-express.ru/tehanaliz/sber/21.04.20,Теханализ,SBER
2020-04-20,,Сбербанк. На таком фоне расти будет сложно,https://bcs-express.ru/tehanaliz/sber/20.04.20,Теханализ,SBER
2020-04-17,,Сбербанк. Разворотная свеча прерывает падение,https://bcs-express.ru/tehanaliz/sber/17.04.20,Теханализ,SBER
2020-04-16,,Сбербанк. Поддержка видится в районе 182,https://bcs-express.ru/tehanaliz/sber/16.04.20,Теханализ,SBER
2020-04-15,,Сбербанк. Обозначились риски коррекции в месячном боковике,https://bcs-express.ru/tehanaliz/sber/15.04.20,Теханализ,SBER
2020-04-14,,Сбербанк. Откат картину не испортил,https://bcs-express.ru/tehanaliz/sber/14.04.20,Теханализ,SBER
2020-04-13,,Сбербанк. В два раза обогнали рынок на неделе,https://bcs-express.ru/tehanaliz/sber/13.04.20,Теханализ,SBER
2020-04-10,,"ЦБ продал Минфину акции Сбербанка по 189,44 руб.",https://bcs-express.ru/novosti-i-analitika/tsb-prodal-minfinu-aktsii-sberbanka-po-189-44-rub,Российский рынок,SBER
2020-04-10,,"Известия: Правительство купило Сбербанк у ЦБ за 2,1 трлн руб.",https://bcs-express.ru/novosti-i-analitika/izvestiia-pravitel-stvo-kupilo-sberbank-u-tsb-za-2-1-trln-rub,Российский рынок,SBER
2020-04-10,,"Сбербанк. Следующая цель — 212,7",https://bcs-express.ru/tehanaliz/sber/10.04.20,Теханализ,SBER
2020-04-09,,Сбербанк. Продолжит рост четвертый день подряд,https://bcs-express.ru/tehanaliz/sber/09.04.20,Теханализ,SBER
2020-04-08,,Сбербанк. Нужно удержаться выше 190,https://bcs-express.ru/tehanaliz/sber/08.04.20,Теханализ,SBER
2020-04-07,,Комиссионные доходы Сбербанка выросли на 20% по итогам I квартала,https://bcs-express.ru/novosti-i-analitika/komissionnye-dokhody-sberbanka-vyrosli-na-20-po-itogam-i-kvartala,Российский рынок,SBER
2020-04-07,,Сбербанк. Пошли к 200,https://bcs-express.ru/tehanaliz/sber/07.04.20,Теханализ,SBER
2020-04-06,,Сбербанк. Пора вырваться из узкого боковика,https://bcs-express.ru/tehanaliz/sber/06.04.20,Теханализ,SBER
2020-04-03,,Сбербанк. Пробой тренда ускорения не придал,https://bcs-express.ru/tehanaliz/sber/03.04.20,Теханализ,SBER
2020-04-02,,Наблюдательный совет Сбербанка перенес дату ГОСА и дивидендную отсечку,https://bcs-express.ru/novosti-i-analitika/nabsovet-sberbanka-perenes-datu-gosa-i-dividendnuiu-otsechku,Российский рынок,SBER
2020-04-02,,Сбербанк. Сохранили шанс на пробой нисходящего тренда,https://bcs-express.ru/tehanaliz/sber/02.04.20,Теханализ,SBER
2020-04-01,,Сбербанк. Мартовский нисходящий тренд не поддался,https://bcs-express.ru/tehanaliz/sber/01.04.20,Теханализ,SBER
2020-03-31,,Помощь Сбербанка сфере гостиничной и торговой недвижимости составила 1 трлн рублей,https://bcs-express.ru/novosti-i-analitika/pomoshch-sberbanka-v-sfere-gostinichnoi-i-torgovoi-nedvizhimosti-sostavila-1-trln-rublei,Российский рынок,SBER
2020-03-30,,Сбербанк. Может протестировать минимумы,https://bcs-express.ru/tehanaliz/sber/30.03.20,Теханализ,SBER
2020-03-27,,Сбербанк. Пробой 182 обнажит риски обновления минимумов,https://bcs-express.ru/tehanaliz/sber/27.03.20,Теханализ,SBER
2020-03-26,,Сбербанк. Мартовские максимумы устанавливаются все ниже,https://bcs-express.ru/tehanaliz/sber/26.03.20,Теханализ,SBER
2020-03-25,,Сбербанк. Будет пробивать нисходящий тренд,https://bcs-express.ru/tehanaliz/sber/25.03.20,Теханализ,SBER
2020-03-24,,Сбербанк. Вернулись в середину боковика,https://bcs-express.ru/tehanaliz/sber/24.03.20,Теханализ,SBER
2020-03-23,,Менеджмент Сбербанка продолжает покупать акции,https://bcs-express.ru/novosti-i-analitika/menedzhment-sberbanka-prodolzhaet-pokupat-aktsii,Российский рынок,SBER
2020-03-23,,"Сбербанк. Краткосрочный нисходящий тренд пробили, но пока только боковик",https://bcs-express.ru/tehanaliz/sber/23.03.20,Теханализ,SBER
2020-03-20,,Сбербанк. Следующие цели — 196 и 205,https://bcs-express.ru/tehanaliz/sber/20.03.20,Теханализ,SBER
