Date,Time,Title,URL,Type,Ticker
2023-01-16,,5 идей в российских акциях: на какие бумаги стоит обратить внимание,https://bcs-express.ru/novosti-i-analitika/2023279537-5-idei-v-rossiiskikh-aktsiiakh-na-kakie-bumagi-stoit-obratit-vnimanie,Российский рынок,SBER
2023-01-16,,Сбербанк — лучшая голубая фишка в начале года,https://bcs-express.ru/novosti-i-analitika/sberbank-luchshaia-golubaia-fishka-v-nachale-goda,Российский рынок,SBER
2023-01-16,,Сбербанк. Новый всплеск активности,https://bcs-express.ru/tehanaliz/sber/16.01.23,Теханализ,SBER
2023-01-13,,Главное за неделю. Игра по новому правилу,https://bcs-express.ru/novosti-i-analitika/glavnoe-za-nedeliu-igra-po-novomu-pravilu,Среднесрочные тренды,SBER
2023-01-13,,"Итоги недели: бюджетное правило, сезон отчетов и дорожающее золото",https://bcs-express.ru/novosti-i-analitika/itogi-pervoi-nedeli-goda-biudzhetnoe-pravilo-sezon-otchetov-i-dorozhaiushchee-zoloto,Российский рынок,SBER
2023-01-13,,Сбербанк: перспективы 2023,https://bcs-express.ru/novosti-i-analitika/sberbank-perspektivy-2023,Мнения,SBER
2023-01-13,,Сбербанк. Сняли локальную перекупленность,https://bcs-express.ru/tehanaliz/sber/13.01.23,Теханализ,SBER
2023-01-12,,Как выходить из убыточных позиций,https://bcs-express.ru/novosti-i-analitika/kak-vykhodit-iz-ubytochnykh-pozitsii,Обучение,SBER
2023-01-12,,Сбербанк. Среднесрочные цели смещаются к 160–170,https://bcs-express.ru/tehanaliz/sber/12.01.23,Теханализ,SBER
2023-01-11,,Какие акции купить новичку,https://bcs-express.ru/novosti-i-analitika/kakie-aktsii-kupit-novichku,Обучение,SBER
2023-01-11,,Акции Сбербанка обновляют максимумы за 9 месяцев. Какие цели ждать,https://bcs-express.ru/novosti-i-analitika/aktsii-sberbanka-obnovliaiut-maksimumy-za-9-mesiatsev-kakie-tseli-zhdat,Российский рынок,SBER
2023-01-11,,Парная идея: Сбербанк против ВТБ,https://bcs-express.ru/novosti-i-analitika/parnaia-ideia-sberbank-protiv-vtb,Торговые рекомендации*,SBER
2023-01-11,,Сбербанк. Ускорения пока не последовало,https://bcs-express.ru/tehanaliz/sber/11.01.23,Теханализ,SBER
2023-01-10,,Сбербанк. Вышли вверх из узкого боковика,https://bcs-express.ru/tehanaliz/sber/10.01.23,Теханализ,SBER
2023-01-09,,5 идей в российских акциях: на какие бумаги стоит обратить внимание,https://bcs-express.ru/novosti-i-analitika/2023206700-5-idei-v-rossiiskikh-aktsiiakh-na-kakie-bumagi-stoit-obratit-vnimanie,Российский рынок,SBER
2023-01-09,,Какие госкомпании могут направить на дивиденды более 50% чистой прибыли,https://bcs-express.ru/novosti-i-analitika/kakie-goskompanii-mogut-napravit-na-dividendy-bolee-50-chistoi-pribyli,Среднесрочные тренды,SBER
2023-01-09,,Еда стала дешевле на 20%. А при чем тут акции?,https://bcs-express.ru/novosti-i-analitika/eda-stala-deshevle-na-27-a-prichem-tut-aktsii,Среднесрочные тренды,SBER
2023-01-09,,Сбербанк. Ждем роста активности и выхода из узкого боковика,https://bcs-express.ru/tehanaliz/sber/09.01.23,Теханализ,SBER
2023-01-06,,Сбербанк. Остаемся в тисках,https://bcs-express.ru/tehanaliz/sber/06.01.23,Теханализ,SBER
2023-01-05,,"Сбербанк. Скорректировались, что теперь",https://bcs-express.ru/tehanaliz/sber/05.01.23,Теханализ,SBER
2023-01-04,,Сбербанк. Продавцы не пускают акцию вверх,https://bcs-express.ru/tehanaliz/sber/04.01.23,Теханализ,SBER
2023-01-04,,Прогнозы и комментарии. Хороший старт — удастся ли поддерживать динамику?,https://bcs-express.ru/novosti-i-analitika/prognozy-i-kommentarii-khoroshii-start-udastsia-li-podderzhivat-dinamiku,Российский рынок,SBER
2023-01-03,,Сбербанк. Уверенный рост — будет ли продолжение?,https://bcs-express.ru/tehanaliz/sber/03.01.23,Теханализ,SBER
2022-12-30,,Сбербанк АО и АП — паритет по цене. Что делать инвестору,https://bcs-express.ru/novosti-i-analitika/sberbank-ao-i-ap-paritet-po-tsene-chto-delat-investoru,Российский рынок,SBER
2022-12-30,,Сколько инвесторы получили в 2022 г. в акциях на СПБ и Мосбирже,https://bcs-express.ru/novosti-i-analitika/skol-ko-investory-poluchili-v-2022-g-v-aktsiiakh-na-spb-i-mosbirzhe,Среднесрочные тренды,SBER
2022-12-30,,Сбербанк. Краткосрочный тренд остался восходящим,https://bcs-express.ru/tehanaliz/sber/30.12.22,Теханализ,SBER
2022-12-29,,Сбербанк. Тестирует поддержки на прочность,https://bcs-express.ru/tehanaliz/sber/29.12.22,Теханализ,SBER
2022-12-28,,Инвестиции 2023: что купить. Полное руководство с прогнозами,https://bcs-express.ru/novosti-i-analitika/investitsii-2023-chto-kupit-polnoe-rukovodstvo-s-prognozami,Среднесрочные тренды,SBER
2022-12-28,,Минфин выступает за дивиденды госкомпаний. Кого это коснется,https://bcs-express.ru/novosti-i-analitika/minfin-vystupaet-za-dividendy-goskompanii-kogo-eto-kosnetsia,Среднесрочные тренды,SBER
2022-12-28,,Риски и возможности предпраздничного рынка,https://bcs-express.ru/novosti-i-analitika/riski-i-vozmozhnosti-predprazdnichnogo-rynka,Мнения,SBER
2022-12-28,,Сбербанк. Покупатели еще не потеряли инициативу,https://bcs-express.ru/tehanaliz/sber/28.12.22,Теханализ,SBER
2022-12-27,,Всепогодный портфель в России на 2023 год,https://bcs-express.ru/novosti-i-analitika/vsepogodnyi-portfel-na-2023-god,Среднесрочные тренды,SBER
2022-12-27,,Куда вложить дивиденды нефтяников,https://bcs-express.ru/novosti-i-analitika/kuda-vlozhit-dividendy-neftianikov,Среднесрочные тренды,SBER
2022-12-27,,Сбербанк. Прицеливается к максимумам декабря,https://bcs-express.ru/tehanaliz/sber/27.12.22,Теханализ,SBER
2022-12-26,,Сбер рассчитывает на «уверенную» прибыль по итогам 2022,https://bcs-express.ru/novosti-i-analitika/sber-rasschityvaet-uverennuiu-pribyl-po-itogam-2022,Российский рынок,SBER
2022-12-26,,5 идей в российских акциях: на какие бумаги стоит обратить внимание,https://bcs-express.ru/novosti-i-analitika/2023479477-5-idei-v-rossiiskikh-aktsiiakh-na-kakie-bumagi-stoit-obratit-vnimanie,Российский рынок,SBER
2022-12-26,,"Сбербанк. Активность снижается, цена уходит в боковик",https://bcs-express.ru/tehanaliz/sber/26.12.22,Теханализ,SBER
2022-12-23,,Перспективные компании в 2023 году: что думают популярные инвесторы «Профита»,https://bcs-express.ru/novosti-i-analitika/perspektivnye-kompanii-v-2023-godu-chto-dumaiut-populiarnye-investory-profita,Новости,SBER
2022-12-23,,Сбербанк. Не удалось продолжить подъем,https://bcs-express.ru/tehanaliz/sber/23.12.22,Теханализ,SBER
2022-12-22,,Топ-10 акций от аналитиков БКС на 2023,https://bcs-express.ru/novosti-i-analitika/top-10-aktsii-ot-analitikov-bks-na-2023,Среднесрочные тренды,SBER
2022-12-22,,Финансовый сектор РФ. Стратегия 2023,https://bcs-express.ru/novosti-i-analitika/finansovyi-sektor-rf-strategiia-2023,Среднесрочные тренды,SBER
2022-12-22,,Сбербанк. Сняли перекупленность и обозначили рамки растущего канала,https://bcs-express.ru/tehanaliz/sber/22.12.22,Теханализ,SBER
2022-12-21,,Российский рынок акций. Стратегия 2023,https://bcs-express.ru/novosti-i-analitika/rossiiskii-rynok-aktsii-strategiia-2023,Российский рынок,SBER
2022-12-21,,Сбербанк. Резкое восстановление,https://bcs-express.ru/tehanaliz/sber/21.12.22,Теханализ,SBER
2022-12-20,,Портфель отраслевых лидеров. Итоги 2022 и новый состав на 2023,https://bcs-express.ru/novosti-i-analitika/kak-portfel-otraslevykh-liderov-otrabotal-2022,Среднесрочные тренды,SBER
2022-12-20,,Сбербанк. Динамичная сессия может быть предвестником разворота,https://bcs-express.ru/tehanaliz/sber/20.12.22,Теханализ,SBER
2022-12-19,,5 идей в российских акциях: на какие бумаги стоит обратить внимание,https://bcs-express.ru/novosti-i-analitika/2023407550-5-idei-v-rossiiskikh-aktsiiakh-na-kakie-bumagi-stoit-obratit-vnimanie,Российский рынок,SBER
2022-12-19,,Сбербанк. Попробует развить отскок,https://bcs-express.ru/tehanaliz/sber/19.12.22,Теханализ,SBER
2022-12-16,,Сбербанк. Вышли к поддержке после четырех дней снижения,https://bcs-express.ru/tehanaliz/sber/16.12.22,Теханализ,SBER
2022-12-15,,Сбербанк. Может опуститься к 134,https://bcs-express.ru/tehanaliz/sber/15.12.22,Теханализ,SBER
2022-12-14,,Чисто «русские ETF». Стоит ли в них инвестировать,https://bcs-express.ru/novosti-i-analitika/chisto-russkie-etf-stoit-li-v-nikh-investirovat,Среднесрочные тренды,SBER
2022-12-14,,Fintarget — Weekly Report. Драйверы на подходе,https://bcs-express.ru/novosti-i-analitika/fintarget-weekly-report-draivery-na-podkhode,Новости,SBER
2022-12-14,,Сбербанк. Пробили растущий тренд,https://bcs-express.ru/tehanaliz/sber/14.12.22,Теханализ,SBER
2022-12-13,,Стоит ли вообще смотреть на динамику S&P 500,https://bcs-express.ru/novosti-i-analitika/stoit-li-voobshche-smotret-na-dinamiku-s-p-500,Среднесрочные тренды,SBER
2022-12-13,,Сбербанк. Решается судьба краткосрочного растущего тренда,https://bcs-express.ru/tehanaliz/sber/13.12.22,Теханализ,SBER
2022-12-12,,5 идей в российских акциях: на какие бумаги стоит обратить внимание,https://bcs-express.ru/novosti-i-analitika/2023340040-5-idei-v-rossiiskikh-aktsiiakh-na-kakie-bumagi-stoit-obratit-vnimanie,Российский рынок,SBER
2022-12-12,,Сбербанк. Важная поддержка смещается все выше,https://bcs-express.ru/tehanaliz/sber/12.12.22,Теханализ,SBER
2022-12-09,,"Главное за неделю. Нефть упала, ралли отменяется?",https://bcs-express.ru/novosti-i-analitika/glavnoe-za-nedeliu-neft-upala-ralli-otmeniaetsia,Среднесрочные тренды,SBER
2022-12-09,,"Итоги недели. Нефтяной потолок, танкерная «пробка» и ускорившаяся инфляция",https://bcs-express.ru/novosti-i-analitika/itogi-nedeli-neftianoi-potolok-tankernaia-probka-i-uskorivshaiasia-infliatsiia,Российский рынок,SBER
2022-12-09,,Сбер: в ноябре сохраняется сильный тренд,https://bcs-express.ru/novosti-i-analitika/sber-v-noiabre-sokhraniaetsia-sil-nyi-trend,Российский рынок,SBER
2022-12-09,,Сбербанк. Консолидация вместо роста,https://bcs-express.ru/tehanaliz/sber/09.12.22,Теханализ,SBER
2022-12-08,,Сбербанк представил результаты за ноябрь. Позитивный отчет,https://bcs-express.ru/novosti-i-analitika/2023292910-sberbank-otchitalsia-za-noiabr,Российский рынок,SBER
2022-12-08,,Сбербанк. Готов продолжить подъем,https://bcs-express.ru/tehanaliz/sber/08.12.22,Теханализ,SBER
2022-12-07,,Что будет с российскими банками. Взгляд аналитиков БКС,https://bcs-express.ru/novosti-i-analitika/chto-budet-s-rossiiskim-bankami-vzgliad-analitikov-bks,Среднесрочные тренды,SBER
2022-12-07,,Сбербанк. Пока в растущем тренде,https://bcs-express.ru/tehanaliz/sber/07.12.22,Теханализ,SBER
2022-12-06,,Сбербанк. Потенциал по выходу из треугольника нацелен на диапазон 145–147,https://bcs-express.ru/tehanaliz/sber/06.12.22,Теханализ,SBER
2022-12-05,,5 идей в российских акциях: на какие бумаги стоит обратить внимание,https://bcs-express.ru/novosti-i-analitika/2023268870-5-idei-v-rossiiskikh-aktsiiakh-na-kakie-bumagi-stoit-obratit-vnimanie,Российский рынок,SBER
2022-12-05,,"Акции Сбербанка растут на 3%, выходя на трехмесячный максимум",https://bcs-express.ru/novosti-i-analitika/aktsii-sberbanka-rastut-na-3-vykhodia-na-trekhmesiachnyi-maksimum,Российский рынок,SBER
2022-12-05,,Сбербанк. Объемы стали неприлично низкими,https://bcs-express.ru/tehanaliz/sber/05.12.22,Теханализ,SBER
2022-12-02,,Сбербанк. Вышли вверх из треугольника,https://bcs-express.ru/tehanaliz/sber/02.12.22,Теханализ,SBER
2022-12-01,,Сбербанк. Пора выходить из спячки,https://bcs-express.ru/tehanaliz/sber/01.12.22,Теханализ,SBER
2022-11-30,,Сбербанк. Готовимся к выходу из треугольника,https://bcs-express.ru/tehanaliz/sber/30.11.22,Теханализ,SBER
2022-11-29,,Как изменились обороты топовых фишек российского рынка,https://bcs-express.ru/novosti-i-analitika/kak-izmenilis-oboroty-topovykh-fishek-rossiiskogo-rynka,Российский рынок,SBER
2022-11-29,,Сбербанк. Пружина может разжаться к середине недели,https://bcs-express.ru/tehanaliz/sber/29.11.22,Теханализ,SBER
2022-11-29,,"Сколько нужно акций, чтобы жить на дивиденды",https://bcs-express.ru/novosti-i-analitika/skol-ko-nuzhno-aktsii-chtoby-zhit-na-dividendy,Обучение,SBER
2022-11-28,,5 идей в российских акциях: на какие бумаги стоит обратить внимание,https://bcs-express.ru/novosti-i-analitika/2023397507-5-idei-v-rossiiskikh-aktsiiakh-na-kakie-bumagi-stoit-obratit-vnimanie,Российский рынок,SBER
2022-11-28,,Сбербанк. Идет к нижней границе треугольника,https://bcs-express.ru/tehanaliz/sber/28.11.22,Теханализ,SBER
2022-11-25,,Какой сектор обходит индекс МосБиржи в 2022,https://bcs-express.ru/novosti-i-analitika/kakoi-sektor-obkhodit-indeks-mosbirzhi-v-2022,Среднесрочные тренды,SBER
2022-11-25,,Сбербанк. Перешли в сходящийся треугольник,https://bcs-express.ru/tehanaliz/sber/25.11.22,Теханализ,SBER
2022-11-24,,Газпром возглавил рейтинг крупнейших компаний-инвесторов в РФ,https://bcs-express.ru/novosti-i-analitika/gazprom-vozglavil-reiting-krupneishikh-kompanii-investorov-v-rf,Российский рынок,SBER
2022-11-24,,Сбербанк. Продолжает восстановление в боковике,https://bcs-express.ru/tehanaliz/sber/24.11.22,Теханализ,SBER
2022-11-23,,"Сбербанк. Удержались от похода на минимумы, актуален боковик",https://bcs-express.ru/tehanaliz/sber/23.11.22,Теханализ,SBER
2022-11-22,,Черная пятница на российском рынке. Какие акции торгуются с хорошей скидкой,https://bcs-express.ru/novosti-i-analitika/chernaia-piatnitsa-na-rossiiskom-rynke-kakie-aktsii-torguiutsia-s-khoroshei-skidkoi,Среднесрочные тренды,SBER
2022-11-22,,Сбербанк. Вышли вниз из растущего канала,https://bcs-express.ru/tehanaliz/sber/22.11.22,Теханализ,SBER
2022-11-21,,5 идей в российских акциях: на какие бумаги стоит обратить внимание,https://bcs-express.ru/novosti-i-analitika/2023326353-5-idei-v-rossiiskikh-aktsiiakh-na-kakie-bumagi-stoit-obratit-vnimanie,Российский рынок,SBER
2022-11-21,,Краткосрочные перспективы российского рынка,https://bcs-express.ru/novosti-i-analitika/kratkosrochnye-perspektivy-rossiiskogo-rynka,Мнения,SBER
2022-11-21,,Сбербанк. Удержались в растущем канале,https://bcs-express.ru/tehanaliz/sber/21.11.22,Теханализ,SBER
2022-11-18,,Сбербанк. Повторное отступление от максимумов снижает оптимизм,https://bcs-express.ru/tehanaliz/sber/18.11.22,Теханализ,SBER
2022-11-17,,"Сбербанк. Отыграли потери, можно продолжать подъем",https://bcs-express.ru/tehanaliz/sber/17.11.22,Теханализ,SBER
2022-11-16,,Сбербанк. Неожиданный провал к 200-часовой средней,https://bcs-express.ru/tehanaliz/sber/16.11.22,Теханализ,SBER
2022-11-15,,Сбербанк. Дивергенция не отменяет целей роста,https://bcs-express.ru/tehanaliz/sber/15.11.22,Теханализ,SBER
2022-11-14,,Итоги торгов. Отскок в акциях Детского Мира и фиксация в Роснефти,https://bcs-express.ru/novosti-i-analitika/itogi-torgov-otskok-v-aktsiiakh-detskogo-mira-i-fiksatsiia-v-rosnefti,Российский рынок,SBER
2022-11-14,,5 идей в российских акциях: на какие бумаги стоит обратить внимание,https://bcs-express.ru/novosti-i-analitika/2023256467-5-idei-v-rossiiskikh-aktsiiakh-na-kakie-bumagi-stoit-obratit-vnimanie,Российский рынок,SBER
2022-11-14,,Сбербанк. Прицеливается на уровни 142–145,https://bcs-express.ru/tehanaliz/sber/14.11.22,Теханализ,SBER
2022-11-11,,Итоги торгов. Индекс МосБиржи закрывает неделю выше 2200,https://bcs-express.ru/novosti-i-analitika/itogi-torgov-indeks-mosbirzhi-zakryvaet-nedeliu-vyshe-2200,Российский рынок,SBER
2022-11-11,,"Итоги недели. Взлет акций банков, обвал Детского мира и другие важные новости",https://bcs-express.ru/novosti-i-analitika/itogi-nedeli-vzlet-aktsii-bankov-obval-detskogo-mira-i-drugie-vazhnye-novosti,Российский рынок,SBER
2022-11-11,,Подробный анализ позитивного отчета Сбербанка,https://bcs-express.ru/novosti-i-analitika/podrobnyi-analiz-pozitivnogo-otcheta-sberbanka,Среднесрочные тренды,SBER
2022-11-11,,Сбербанк. 7% роста — не предел,https://bcs-express.ru/tehanaliz/sber/11.11.22,Теханализ,SBER
2022-11-11,,Минфин США продлил разрешение на сделки по энергоносителям с банками РФ,https://bcs-express.ru/novosti-i-analitika/minfin-ssha-prodlil-razreshenie-na-sdelki-po-energonositeliami-s-bankami-rf,Новости,SBER
2022-11-11,,Прогнозы и комментарии. Ралли в акциях банков,https://bcs-express.ru/novosti-i-analitika/prognozy-i-kommentarii-ralli-v-aktsiiakh-bankov,Российский рынок,SBER
2022-11-10,,Каким будет рынок России через 10 лет,https://bcs-express.ru/novosti-i-analitika/kakim-budet-rynok-rossii-cherez-10-let,Мнения,SBER
2022-11-10,,Сбербанк планирует вернуться к выплате дивидендов в 2023,https://bcs-express.ru/novosti-i-analitika/sberbank-planiruet-vernut-sia-k-vyplate-dividendov-v-2023-godu,Российский рынок,SBER
2022-11-10,,Мнение аналитиков. Что ждать от отчетности Ozon,https://bcs-express.ru/novosti-i-analitika/mnenie-analitikov-chto-zhdat-ot-otchetnosti-ozon,Новости,SBER
2022-11-10,,Сбербанк впервые с начала года опубликовал финансовый отчет. Акции растут,https://bcs-express.ru/novosti-i-analitika/sberbank-vpervye-s-nachala-goda-opublikoval-finansovyi-otchet-aktsii-rastut,Российский рынок,SBER
2022-11-10,,Сбер снова начнет публиковать финансовые результаты. Прибыль в октябре — 122 млрд,https://bcs-express.ru/novosti-i-analitika/sber-snova-nachnet-publikovat-finansovye-rezul-taty-pribyl-v-oktiabre-122-mlrd,Российский рынок,SBER
2022-11-10,,Сбербанк. Не удержали поддержки,https://bcs-express.ru/tehanaliz/sber/10.11.22,Теханализ,SBER
2022-11-10,,Ожидаемые события на 10 ноября,https://bcs-express.ru/novosti-i-analitika/2023210110-ozhidaemye-sobytiia-na-9-noiabria,Российский рынок,SBER
2022-11-09,,Сбербанк ждет сокращение выдачи ипотеки по итогам 2022,https://bcs-express.ru/novosti-i-analitika/sberbank-zhdet-sokrashchenie-vydachi-ipoteki-po-itogam-2022,Новости,SBER
2022-11-09,,5 идей в российских акциях: на какие бумаги стоит обратить внимание,https://bcs-express.ru/novosti-i-analitika/2023208007-5-idei-v-rossiiskikh-aktsiiakh-na-kakie-bumagi-stoit-obratit-vnimanie,Российский рынок,SBER
2022-11-09,,Сбербанк. Тестирует сверху пробитый тренд,https://bcs-express.ru/tehanaliz/sber/09.11.22,Теханализ,SBER
2022-11-08,,Сбербанк. Пробой среднесрочного нисходящего тренда — позитивный сигнал,https://bcs-express.ru/tehanaliz/sber/08.11.22,Теханализ,SBER
2022-11-07,,Сбербанк. Пора штурмовать нисходящий тренд,https://bcs-express.ru/tehanaliz/sber/07.11.22,Теханализ,SBER
2022-11-03,,Обычка или преф? Какие есть неэффективности в акциях,https://bcs-express.ru/novosti-i-analitika/obychka-ili-pref-kakie-est-neeffektivnosti-v-aktsiiakh,Среднесрочные тренды,SBER
2022-11-03,,Исследование. Кто любимчик инвесторов в финансовом секторе,https://bcs-express.ru/novosti-i-analitika/zavershaiushchie-issledovanie-kto-liubimchik-investorov-v-finansovom-sektore,Среднесрочные тренды,SBER
2022-11-03,,Сбербанк. Продавцы еще не завладели инициативой,https://bcs-express.ru/tehanaliz/sber/03.11.22,Теханализ,SBER
2022-11-02,,"Дивидендный фактор. Сколько должны стоить Газпром, Сбер и прочие",https://bcs-express.ru/novosti-i-analitika/dividendnyi-faktor-skol-ko-dolzhny-stoit-gazprom-sber-i-prochie,Российский рынок,SBER
2022-11-02,,"Сбербанк. Активность снизилась, но коррекции не последовало",https://bcs-express.ru/tehanaliz/sber/02.11.22,Теханализ,SBER
2022-11-01,,"Самые прибыльные компании России: кто в топе, помимо Газпрома",https://bcs-express.ru/novosti-i-analitika/samye-pribyl-nye-kompanii-rossii-kto-v-tope-pomimo-gazproma,Около рынка,SBER
2022-11-01,,Сбербанк. После паузы в боковике может продолжить подъем,https://bcs-express.ru/tehanaliz/sber/01.11.22,Теханализ,SBER
2022-10-31,,"Сбербанк. Вышли из крутого канала, но закрыли день в плюсе",https://bcs-express.ru/tehanaliz/sber/31.10.22,Теханализ,SBER
2022-10-28,,Сбербанк. Цена может ненадолго перейти в боковик,https://bcs-express.ru/tehanaliz/sber/28.10.22,Теханализ,SBER
