Date,Time,Title,URL,Type,Ticker
2017-09-28,,Сбербанк. Все растет и растет,https://bcs-express.ru/tehanaliz/sber/28.09.17,Теханализ,SBER
2017-09-27,,Сбербанк. На рекордных уровнях последовала фиксация,https://bcs-express.ru/tehanaliz/sber/27.09.17,Теханализ,SBER
2017-09-26,,"Сбербанк. Коррекция прервана, готовимся к штурму рекордных рубежей",https://bcs-express.ru/tehanaliz/sber/26.09.17,Теханализ,SBER
2017-09-25,,Итоги торгов. Серьезная заявка на выход из консолидации вверх,https://bcs-express.ru/novosti-i-analitika/itogi-torgov-ser-eznaia-zaiavka-na-vykhod-iz-konsolidatsii-vverkh,Российский рынок,SBER
2017-09-25,,Сбербанк. Риск формирования разворотной фигуры сохраняется,https://bcs-express.ru/tehanaliz/sber/25.09.17,Теханализ,SBER
2017-09-22,,Сбербанк. Голова-плечи еще может сформироваться,https://bcs-express.ru/tehanaliz/sber/22.09.17,Теханализ,SBER
2017-09-21,,«Акулы» банковского сектора,https://bcs-express.ru/novosti-i-analitika/akuly-bankovskogo-sektora,Российский рынок,SBER
2017-09-21,,Сбербанк. Отскок в рамках широкой консолидации,https://bcs-express.ru/tehanaliz/sber/21.09.17,Теханализ,SBER
2017-09-20,,Сбербанк. Подошли к поддержке,https://bcs-express.ru/tehanaliz/sber/20.09.17,Теханализ,SBER
2017-09-19,,Итоги торгов. Игнорируем внешний позитив – серьезный признак разворота?,https://bcs-express.ru/novosti-i-analitika/itogi-torgov-ignoriruem-vneshnii-pozitiv-ser-eznyi-priznak-razvorota,Российский рынок,SBER
2017-09-19,,"Сбербанк. Нацеливается на 184,6",https://bcs-express.ru/tehanaliz/sber/19.09.17,Теханализ,SBER
2017-09-18,,Сбербанк. Не хочет падать,https://bcs-express.ru/tehanaliz/sber/18.09.17,Теханализ,SBER
2017-09-15,,Сбербанк. Пробит месячный восходящий тренд,https://bcs-express.ru/tehanaliz/sber/15.09.17,Теханализ,SBER
2017-09-14,,Сбербанк. Прервать коррекцию не удалось,https://bcs-express.ru/tehanaliz/sber/14.09.17,Теханализ,SBER
2017-09-13,,Сбербанк. Фиксация стартовала,https://bcs-express.ru/tehanaliz/sber/13.09.17,Теханализ,SBER
2017-09-12,,Итоги торгов. ММВБ обновил полугодовой максимум на повышении нефти в рублях,https://bcs-express.ru/novosti-i-analitika/itogi-torgov-mmvb-obnovil-polugodovoi-maksimum-na-povyshenii-nefti-v-rubliakh,Российский рынок,SBER
2017-09-12,,Где был бы индекс ММВБ без Сбербанка,https://bcs-express.ru/novosti-i-analitika/gde-byl-by-rossiiskii-rynok-esli-by-ne-sberbank,Среднесрочные тренды,SBER
2017-09-12,,Сбербанк. Еще полшага и короткие позиции станут актуальны,https://bcs-express.ru/tehanaliz/sber/12.09.17,Теханализ,SBER
2017-09-12,,Прогнозы и комментарии. Сбербанк – главный локомотив роста,https://bcs-express.ru/novosti-i-analitika/prognozy-i-kommentarii-sberbank-glavnyi-lokomotiv-rosta,Российский рынок,SBER
2017-09-11,,Итоги торгов. Скромное повышение на фоне мирового ралли – устали расти?,https://bcs-express.ru/novosti-i-analitika/itogi-torgov-skromnoe-povyshenie-na-fone-mirovogo-ralli-ustali-rasti,Российский рынок,SBER
2017-09-11,,"Ход торгов. Рост продолжается, Сбербанк опять обновил исторический максимум",https://bcs-express.ru/novosti-i-analitika/khod-torgov-rost-prodolzhaetsia-sberbank-opiat-obnovil-istoricheskii-maksimum,Российский рынок,SBER
2017-09-11,,Сбербанк. Вырвались из треугольника,https://bcs-express.ru/tehanaliz/sber/11.09.17,Теханализ,SBER
2017-09-08,,"Когда нужно покупать Сбербанк-АО, а когда Сбербанк-АП?",https://bcs-express.ru/novosti-i-analitika/kogda-nuzhno-pokupat-sberbank-ao-a-kogda-sberbank-ap,Российский рынок,SBER
2017-09-08,,Сбербанк. Простор для маневра в треугольнике почти исчерпан,https://bcs-express.ru/tehanaliz/sber/08.09.17,Теханализ,SBER
2017-09-07,,Итоги торгов. Обилие важных и неожиданных сигналов смутило рынки,https://bcs-express.ru/novosti-i-analitika/itogi-torgov-obilie-vazhnykh-i-neozhidannykh-signalov-smutilo-rynki,Российский рынок,SBER
2017-09-07,,Видеокомментарий: рекомендуем к покупке акции МТС и Роснефти,https://bcs-express.ru/novosti-i-analitika/videokommentarii-rekomenduem-k-pokupke-aktsii-mts-i-rosnefti,Российский рынок,SBER
2017-09-07,,Четыре дешевых российских «префа»,https://bcs-express.ru/novosti-i-analitika/chetyre-deshevykh-rossiiskikh-prefa,Среднесрочные тренды,SBER
2017-09-07,,Сбербанк. Удержались в треугольнике,https://bcs-express.ru/tehanaliz/sber/07.09.17,Теханализ,SBER
2017-09-07,,"Чистая прибыль Сбербанка в августе составила 60,6 млрд руб.",https://bcs-express.ru/novosti-i-analitika/chistaia-pribyl-sberbanka-v-avguste-sostavila-60-6-mlrd-rub,Новости,SBER
2017-09-06,,"Итоги торгов. Мы возобновили уверенный рост, нацелившись на новые максимумы",https://bcs-express.ru/novosti-i-analitika/itogi-torgov-my-vozobnovili-uverennyi-rost-natselivshis-na-novye-maksimumy,Российский рынок,SBER
2017-09-06,,Ход торгов. Российский рынок решил взять паузу из-за коррекции тяжеловесов,https://bcs-express.ru/novosti-i-analitika/khod-torgov-rossiiskii-rynok-reshil-vziat-pauzu-iz-za-korrektsii-tiazhelovesov,Российский рынок,SBER
2017-09-06,,Сбербанк. Ждать коррекции стоит с выходом вниз из треугольника,https://bcs-express.ru/tehanaliz/sber/06.09.17,Теханализ,SBER
2017-09-05,,Сбербанк. Коррекция до сих пор не получила ускорения,https://bcs-express.ru/tehanaliz/sber/05.09.17,Теханализ,SBER
2017-09-04,,40+ прибыльных идей. Отчет по опубликованным инвестидеям за 10 месяцев,https://bcs-express.ru/novosti-i-analitika/otchet-po-opublikovannym-investideiam-za-9-mesiatsev,Среднесрочные тренды,SBER
2017-09-04,,Сбербанк. Разгружает перекупленность,https://bcs-express.ru/tehanaliz/sber/04.09.17,Теханализ,SBER
2017-09-01,,"Сбербанк. Ну, вот и все",https://bcs-express.ru/tehanaliz/sber/01.09.17,Теханализ,SBER
2017-08-31,,"Итоги торгов. Ралли продолжается, лидеры меняются",https://bcs-express.ru/novosti-i-analitika/itogi-torgov-ralli-prodolzhaetsia-lidery-meniaiutsia,Российский рынок,SBER
2017-08-31,,Сбербанк покорил новую вершину,https://bcs-express.ru/novosti-i-analitika/sberbank-pokoril-novuiu-vershinu,Новости,SBER
2017-08-31,,Сбербанк. Полпроцента не дошли до исторического максимума,https://bcs-express.ru/tehanaliz/sber/31.08.17,Теханализ,SBER
2017-08-30,,"Итоги торгов. Российский рынок ускорил рост, лидирует банковский сектор",https://bcs-express.ru/novosti-i-analitika/itogi-torgov-rossiiskii-rynok-uskoril-rost-lidiruet-bankovskii-sektor,Российский рынок,SBER
2017-08-30,,Сбербанк. Может дотянуться до 184,https://bcs-express.ru/tehanaliz/sber/30.08.17,Теханализ,SBER
2017-08-29,,Лучшие и худшие компании финансового сектора,https://bcs-express.ru/novosti-i-analitika/luchshie-i-khudshie-kompanii-finansovogo-sektora,Российский рынок,SBER
2017-08-29,,Сбербанк. Перекупленность сохраняется,https://bcs-express.ru/tehanaliz/sber/29.08.17,Теханализ,SBER
2017-08-29,,Чем так важен суд «Транснефти» и Сбербанка,https://bcs-express.ru/novosti-i-analitika/chem-tak-vazhen-sud-transnefti-i-sberbanka,Российский рынок,SBER
2017-08-28,,Сбербанк. Надвигается коррекция,https://bcs-express.ru/tehanaliz/sber/28.08.17,Теханализ,SBER
2017-08-25,,Итоги торгов. Тише едем – дальше будем,https://bcs-express.ru/novosti-i-analitika/itogi-torgov-tishe-edem-dal-she-budem,Российский рынок,SBER
2017-08-25,,Сбербанк. Выход из боковика привел к ускорению роста,https://bcs-express.ru/tehanaliz/sber/25.08.17,Теханализ,SBER
2017-08-25,,Русал и Сбербанк договрились о переносе срока погашения долга,https://bcs-express.ru/novosti-i-analitika/rusal-i-sberbank-dogovrilis-o-perenose-sroka-pogasheniia-dolga,Новости,SBER
2017-08-25,,Инвестидея в Сбербанке успешно реализовалась,https://bcs-express.ru/novosti-i-analitika/investideia-v-sberbanke-uspeshno-realizovalas,Новости,SBER
2017-08-25,,Прогнозы и комментарии. Сбербанк вытягивает весь индекс ММВБ наверх,https://bcs-express.ru/novosti-i-analitika/prognozy-i-kommentarii-sberbank-vytiagivaet-ves-indeks-mmvb-naverkh,Российский рынок,SBER
2017-08-24,,Итоги торгов. Продолжаем обновлять максимумы вопреки внешнему фону,https://bcs-express.ru/novosti-i-analitika/itogi-torgov-prodolzhaem-obnovliat-maksimumy-vopreki-vneshnemu-fonu,Российский рынок,SBER
2017-08-24,,Видеокомментарий: Рекомендуем покупать акции «Сбербанка»,https://bcs-express.ru/novosti-i-analitika/videokommentarii-rekomenduem-pokupat-aktsii-sberbanka,Российский рынок,SBER
2017-08-24,,"Ход торгов. Российский рынок продолжает расти, игнорируя любой негатив",https://bcs-express.ru/novosti-i-analitika/khod-torgov-rossiiskii-rynok-prodolzhaet-rasti-ignoriruia-umerennyi-negativ,Российский рынок,SBER
2017-08-24,,Сбербанк. Может переписать максимумы августа,https://bcs-express.ru/tehanaliz/sber/24.08.17,Теханализ,SBER
2017-08-23,,"Итоги торгов. Медленно, но верно движемся к новым максимумам",https://bcs-express.ru/novosti-i-analitika/itogi-torgov-medlenno-no-verno-dvizhemsia-k-novym-maksimumam,Российский рынок,SBER
2017-08-23,,Решение суда по иску Транснефти придало ускорение акциям Сбербанка,https://bcs-express.ru/novosti-i-analitika/reshenie-suda-po-isku-transnefti-pridalo-uskorenie-aktsiiam-sberbanka,Новости,SBER
2017-08-23,,Сбербанк. Выше пятничных максимумов не ушли,https://bcs-express.ru/tehanaliz/sber/23.08.17,Теханализ,SBER
2017-08-23,,Чистая прибыль Сбербанка превысила прогнозы аналитиков,https://bcs-express.ru/novosti-i-analitika/chistaia-pribyl-sberbanka-prevysila-prognozy-analitikov,Новости,SBER
2017-08-22,,Сбербанк. Закрытие гэпа не теряет актуальности,https://bcs-express.ru/tehanaliz/sber/22.08.17,Теханализ,SBER
2017-08-21,,Итоги торгов. Выросли вопреки внешнему фону,https://bcs-express.ru/novosti-i-analitika/itogi-torgov-vyrosli-vopreki-vneshnemu-fonu,Российский рынок,SBER
2017-08-21,,Сбербанк. Возможность роста сохраняется до пробоя 168,https://bcs-express.ru/tehanaliz/sber/21.08.17,Теханализ,SBER
2017-08-18,,Итоги торгов. Перед выходными мы решили учесть в котировках выросшие риски,https://bcs-express.ru/novosti-i-analitika/itogi-torgov-pered-vykhodnymi-my-reshili-uchest-v-kotirovkakh-vyrosshie-riski,Российский рынок,SBER
2017-08-18,,Сбербанк. Слишком много негативных свечей,https://bcs-express.ru/tehanaliz/sber/18.08.17,Теханализ,SBER
2017-08-17,,Сбербанк. Дневная свеча предвещает падение,https://bcs-express.ru/tehanaliz/sber/17.08.17,Теханализ,SBER
2017-08-16,,Сбербанк. Для продолжения роста нужно пробить сопротивление на уровне 174,https://bcs-express.ru/tehanaliz/sber/16.08.17,Теханализ,SBER
2017-08-15,,Сбербанк: Пробой уровня 174 откроет путь на максимумы,https://bcs-express.ru/tehanaliz/sber/15.08.17,Теханализ,SBER
2017-08-14,,Сбербанк: Коррекция может продолжиться,https://bcs-express.ru/tehanaliz/sber/14.08.17,Теханализ,SBER
2017-08-11,,Сбербанк: Негативные сигналы подтверждаются,https://bcs-express.ru/tehanaliz/sber/11.08.17,Теханализ,SBER
2017-08-10,,Сбербанк: Сигналы осцилляторов усилились разворотной моделью Харами,https://bcs-express.ru/tehanaliz/sber/10.08.17,Теханализ,SBER
2017-08-09,,Сбербанк: Коррекция может последовать с открытия,https://bcs-express.ru/tehanaliz/sber/09.08.17,Теханализ,SBER
2017-08-08,,Итоги торгов: Российский рынок наконец-то присоединился к мировому ралли,https://bcs-express.ru/novosti-i-analitika/itogi-torgov-rossiiskii-rynok-nakonets-to-prisoedinilsia-k-mirovomu-ralli,Российский рынок,SBER
2017-08-08,,Сбербанк: Вышел на полугодовые максимумы,https://bcs-express.ru/tehanaliz/sber/08.08.17,Теханализ,SBER
2017-08-07,,Итоги торгов: Рост вопреки внешнему негативу,https://bcs-express.ru/novosti-i-analitika/itogi-torgov-rost-vopreki-vneshnemu-negativu,Российский рынок,SBER
2017-08-07,,Видео: Покупаем акции Сбербанка после пробоя уровня в 172 руб.,https://bcs-express.ru/novosti-i-analitika/video-pokupaem-aktsii-sberbanka-posle-proboia-urovnia-v-172-rub,Российский рынок,SBER
2017-08-07,,"Сбербанк: Вышел из клина, но ускорения не последовало",https://bcs-express.ru/tehanaliz/sber/07.08.17,Теханализ,SBER
2017-08-07,,"Чистая прибыль Сбербанка в июле составила 55,9 млрд руб.",https://bcs-express.ru/novosti-i-analitika/chistaia-pribyl-sberbanka-v-iiule-sostavila-55-9-mlrd-rub,Новости,SBER
2017-08-04,,Сбербанк: Готовится выйти вниз из клина,https://bcs-express.ru/tehanaliz/sber/04.08.17,Теханализ,SBER
2017-08-04,,Белорусский бизнесмен отказался от украинской дочки Сбербанка,https://bcs-express.ru/novosti-i-analitika/belorusskii-biznesmen-otkazalsia-ot-ukrainskoi-dochki-sberbanka,Новости,SBER
2017-08-03,,Сбербанк: Июльское сопротивление не остановило рост,https://bcs-express.ru/tehanaliz/sber/03.08.17,Теханализ,SBER
2017-08-02,,Итоги торгов: Наш рынок продемонстрировал стремление к новым вершинам,https://bcs-express.ru/novosti-i-analitika/itogi-torgov-nash-rynok-prodemonstriroval-stremlenie-k-novym-vershinam,Российский рынок,SBER
2017-08-02,,"Сбербанк: Коррекция возможна, но down-тренд 2017 года теряет актуальность",https://bcs-express.ru/tehanaliz/sber/02.08.17,Теханализ,SBER
2017-08-01,,Сбербанк: Пробой поддержки так и не последовал,https://bcs-express.ru/tehanaliz/sber/01.08.17,Теханализ,SBER
2017-07-31,,«Префы» Сбербанка обновили исторические максимумы,https://bcs-express.ru/novosti-i-analitika/prefy-sberbanka-obnovili-istoricheskie-maksimumy,Новости,SBER
2017-07-31,,Сбербанк: Негативным сигналом будет пробой пятничных минимумов,https://bcs-express.ru/tehanaliz/sber/31.07.17,Теханализ,SBER
2017-07-28,,Топ-5 up-трендов на российском рынке с кризиса 2008 года,https://bcs-express.ru/novosti-i-analitika/top-5-up-trendov-na-rossiiskom-rynke-s-krizisa-2008-goda,Российский рынок,SBER
2017-07-28,,Сбербанк: Даешь 170!,https://bcs-express.ru/tehanaliz/sber/28.07.17,Теханализ,SBER
2017-07-27,,Сбербанк: Коррекция прервалась,https://bcs-express.ru/tehanaliz/sber/27.07.17,Теханализ,SBER
2017-07-26,,Сбербанк: Попробуем возобновить рост?,https://bcs-express.ru/tehanaliz/sber/26.07.17,Теханализ,SBER
2017-07-25,,Сбербанк: Выкупили дневную просадку,https://bcs-express.ru/tehanaliz/sber/25.07.17,Теханализ,SBER
2017-07-24,,Сбербанк: Разворотный сигнал подтвердился,https://bcs-express.ru/tehanaliz/sber/24.07.17,Теханализ,SBER
2017-07-21,,Сбербанк: Еще полшага до нисходящего тренда,https://bcs-express.ru/tehanaliz/sber/21.07.17,Теханализ,SBER
2017-07-20,,Сбербанк: Подходит к down-тренду тянущемуся от рекордных уровней,https://bcs-express.ru/tehanaliz/sber/20.07.17,Теханализ,SBER
2017-07-19,,Сбербанк: Осцилляторы на дневном таймфрейме разворачиваются вниз,https://bcs-express.ru/tehanaliz/sber/19.07.17,Теханализ,SBER
2017-07-18,,Сбербанк: Шансы на выход к 166 не потеряны,https://bcs-express.ru/tehanaliz/sber/18.07.17,Теханализ,SBER
2017-07-17,,"Сбербанк: Вместо коррекции, цена консолидируется на максимумах",https://bcs-express.ru/tehanaliz/sber/17.07.17,Теханализ,SBER
2017-07-14,,"Сбербанк: Пошли вниз, но быки сопротивляются",https://bcs-express.ru/tehanaliz/sber/14.07.17,Теханализ,SBER
2017-07-13,,Сбербанк: Коррекция приближается,https://bcs-express.ru/tehanaliz/sber/13.07.17,Теханализ,SBER
2017-07-12,,Сбербанк: Достигли границы месячного восходящего канала,https://bcs-express.ru/tehanaliz/sber/12.07.17,Теханализ,SBER
2017-07-11,,Сбербанк: Цели бычьего флага по большей части реализованы,https://bcs-express.ru/tehanaliz/sber/11.07.17,Теханализ,SBER
2017-07-10,,Итоги торгов: Российский рынок продолжает проявлять свою силу,https://bcs-express.ru/novosti-i-analitika/itogi-torgov-rossiiskii-rynok-prodolzhaet-proiavliat-svoiu-silu,Российский рынок,SBER
2017-07-10,,Видео: Сильная отчетность поддержала акции Сбербанка,https://bcs-express.ru/novosti-i-analitika/video-sil-naia-otchetnost-podderzhala-aktsii-sberbanka,Российский рынок,SBER
2017-07-10,,Сбербанк: Сигналов перекупленности пока нет,https://bcs-express.ru/tehanaliz/sber/10.07.17,Теханализ,SBER
2017-07-07,,"Итоги торгов: Несмотря на снижение, показали устойчивость к негативу",https://bcs-express.ru/novosti-i-analitika/itogi-torgov-nesmotria-na-snizhenie-pokazali-ustoichivost-k-negativu,Российский рынок,SBER
2017-07-07,,Сбербанк: Выкуп просадки в последний час не дал оформиться разворотной свече,https://bcs-express.ru/tehanaliz/sber/07.07.17,Теханализ,SBER
2017-07-07,,"Чистая прибыль Сбербанка в июле составила 55,9 млрд руб",https://bcs-express.ru/novosti-i-analitika/chistaia-pribyl-sberbanka-v-pervom-polugodii-vyrosla-na-38,Новости,SBER
2017-07-06,,Сбербанк: Откат не привел к серьезным последствиям,https://bcs-express.ru/tehanaliz/sber/06.07.17,Теханализ,SBER
2017-07-05,,Сбербанк: Цели бычьего флага простираются до 158,https://bcs-express.ru/tehanaliz/sber/05.07.17,Теханализ,SBER
2017-07-04,,Итоги торгов: Нефть и рубль разошлись – российский рынок вырос,https://bcs-express.ru/novosti-i-analitika/itogi-torgov-neft-i-rubl-razoshlis-rossiiskii-rynok-vyros,Российский рынок,SBER
2017-07-04,,Сбербанк: В попытке закрыть дивидендный гэп,https://bcs-express.ru/tehanaliz/sber/04.07.17,Теханализ,SBER
2017-07-03,,Сбербанк: Выход из боковика поможет определиться с направлением,https://bcs-express.ru/tehanaliz/sber/03.07.17,Теханализ,SBER
2017-06-30,,Итоги торгов: Худшее первое полугодие с 1998 года,https://bcs-express.ru/novosti-i-analitika/itogi-torgov-samoe-plokhoe-pervoe-polugodie-s-1998-goda,Российский рынок,SBER
2017-06-30,,"Сбербанк: Может протестировать нижнюю границу боковика 141,8-147,3",https://bcs-express.ru/tehanaliz/sber/30.06.17,Теханализ,SBER
2017-06-30,,Завтрак инвестора: Правительство ждет от Сбербанка повышения дивидендов,https://bcs-express.ru/novosti-i-analitika/zavtrak-investora-pravitel-stvo-zhdet-ot-sberbanka-povysheniia-dividendov,Новости,SBER
2017-06-29,,Сбербанк: Намечается еще одна попытка выхода на закрытие дивидендного гэпа,https://bcs-express.ru/tehanaliz/sber/29.06.17,Теханализ,SBER
2017-06-29,,Прогнозы и комментарии: Сбербанк и Газпром не догоняют,https://bcs-express.ru/novosti-i-analitika/prognozy-i-kommentarii-sberbank-i-gazprom-ne-dogoniaiut,Российский рынок,SBER
2017-06-28,,Итоги торгов: Слабый рубль и внешний позитив толкают рублевые активы вверх,https://bcs-express.ru/novosti-i-analitika/itogi-torgov-slabyi-rubl-i-vneshnii-pozitiv-tolkaiut-rublevye-aktivy-vverkh,Российский рынок,SBER
2017-06-28,,"Сбербанк: В третий раз пойдет вниз от 147,1-147,3",https://bcs-express.ru/tehanaliz/sber/28.06.17,Теханализ,SBER
2017-06-27,,"Сбербанк: Может последовать откат к 141,8",https://bcs-express.ru/tehanaliz/sber/27.06.17,Теханализ,SBER
2017-06-26,,Потери государства из-за банкротства банков за год составили 100 млрд руб.,https://bcs-express.ru/novosti-i-analitika/poteri-gosudarstva-vsledstvie-bankrotstva-bankov-za-god-sostavili-100-mlrd-rub,Новости,SBER
2017-06-26,,Иск Транснефти к Сбербанку несет угрозу на триллион рублей,https://bcs-express.ru/novosti-i-analitika/2017875543-isk-transnefti-k-sberbanku-neset-potentsial-nuiu-ugrozu-trillionnykh-ubytkov-rossiiskim-bankam,Новости,SBER
2017-06-26,,Сбербанк: Нисходящий тренд теряет актуальность,https://bcs-express.ru/tehanaliz/sber/26.06.17,Теханализ,SBER
2017-06-23,,Сбербанк: Пробой не засчитан,https://bcs-express.ru/tehanaliz/sber/23.06.17,Теханализ,SBER
2017-06-22,,Сбербанк: Сигналы разворотной свечи нашли подтверждение,https://bcs-express.ru/tehanaliz/sber/22.06.17,Теханализ,SBER
2017-06-21,,Сбербанк: Нисходящий тренд дал отпор,https://bcs-express.ru/tehanaliz/sber/21.06.17,Теханализ,SBER
2017-06-20,,Сбербанк: Близки к штурму месячного down-тренда,https://bcs-express.ru/tehanaliz/sber/20.06.17,Теханализ,SBER
