Date,Title,URL
21 сентября 2017,Газпром. Ждем еще одной попытки падения ниже 121 руб.,https://bcs-express.ru/novosti-i-analitika/gazprom-zhdem-eshche-odnoi-popytki-padeniia-nizhe-121-rub
20 сентября 2017,«Газпром» удвоит инвестиции в «Турецкий поток» в 2017 году,https://bcs-express.ru/novosti-i-analitika/gazprom-udvoit-investitsii-v-turetskii-potok-v-2017-godu
15 сентября 2017,Видео: подтверждаем рекомендацию «покупать» по акциям Северстали,https://bcs-express.ru/novosti-i-analitika/video-podtverzhdaem-rekomendatsiiu-pokupat-po-aktsiiam-severstali
15 сентября 2017,Что означает увеличение инвестпрограммы Газпрома,https://bcs-express.ru/novosti-i-analitika/chto-oznachaet-uvelichenie-investprogrammy-gazproma
14 сентября 2017,Видеокомментарий: ключевое событие недели – заседание ЦБ РФ,https://bcs-express.ru/novosti-i-analitika/2018055740-videokommentarii-kliuchevoe-sobytie-nedeli-zasedanie-tsb-rf
14 сентября 2017,Прогнозы и комментарии. Газпром перехватывает инициативу у Сбербанка,https://bcs-express.ru/novosti-i-analitika/prognozy-i-kommentarii-gazprom-perekhvatyvaet-initsiativu-u-sberbanka
13 сентября 2017,Видеокомментарий: позитивная новость для Роснефти,https://bcs-express.ru/novosti-i-analitika/videokommentarii-pozitivnaia-novost-dlia-rosnefti
12 сентября 2017,"Видеокомментарий: внимание на Газпром, Новатэк, Роснефть",https://bcs-express.ru/novosti-i-analitika/videokommentarii-vnimanie-na-gazprom-novatek-rosneft
11 сентября 2017,Газпром. Используем просадку для накапливания акций,https://bcs-express.ru/novosti-i-analitika/gazprom-ispol-zuem-prosadku-dlia-nakaplivaniia-aktsii
4 сентября 2017,Дивиденды в 50% от чистой прибыли для Газпрома пока не актуальны,https://bcs-express.ru/novosti-i-analitika/dividendy-v-50-ot-chistoi-pribyli-dlia-gazproma-poka-ne-aktual-ny
4 сентября 2017,40+ прибыльных идей. Отчет по опубликованным инвестидеям за 10 месяцев,https://bcs-express.ru/novosti-i-analitika/otchet-po-opublikovannym-investideiam-za-9-mesiatsev
30 августа 2017,"Инвесторы не знают, как отнестись к отчетности Газпрома за I полугодие",https://bcs-express.ru/novosti-i-analitika/investory-ne-znaiut-kak-otnestis-k-otchetnosti-gazproma-za-i-polugodie-2017g-po-msfo
21 августа 2017,Газпром. Дневная свеча выступает в пользу отскока наверх,https://bcs-express.ru/tehanaliz/gazp/21.08.17
18 августа 2017,Лучшие и худшие акции нефтегазового сектора,https://bcs-express.ru/novosti-i-analitika/neftegazovye-kompanii-goda
4 сентября 2017,40+ прибыльных идей. Отчет по опубликованным инвестидеям за 10 месяцев,https://bcs-express.ru/novosti-i-analitika/otchet-po-opublikovannym-investideiam-za-9-mesiatsev
17 августа 2017,Газпром готовится обновить рекорд,https://bcs-express.ru/novosti-i-analitika/gazprom-gotovitsia-obnovit-rekord
14 августа 2017,"Чистая прибыль Газпрома по РСБУ в I полугодии снизилась в 11,2 раза",https://bcs-express.ru/novosti-i-analitika/chistaia-pribyl-gazproma-po-rsbu-v-i-polugodii-snizilas-v-11-2-raza
14 августа 2017,Газпром может изменить дивидендную политику,https://bcs-express.ru/novosti-i-analitika/sovet-direktorov-gazproma-29-avgusta-obsudit-budushchuiu-dividendnuiu-politiku
8 августа 2017,S&P видит риск перебоев поставок газа из РФ в Европу из-за санкций,https://bcs-express.ru/novosti-i-analitika/s-p-vidit-risk-pereboev-postavok-gaza-iz-rf-v-evropu-iz-za-sanktsii
4 августа 2017,Насколько реальны новые санкции США против Газпрома?,https://bcs-express.ru/novosti-i-analitika/naskol-ko-real-ny-novye-sanktsii-ssha-protiv-gazproma
4 сентября 2017,40+ прибыльных идей. Отчет по опубликованным инвестидеям за 10 месяцев,https://bcs-express.ru/novosti-i-analitika/otchet-po-opublikovannym-investideiam-za-9-mesiatsev
1 августа 2017,Газпром: экспорт продолжает бить рекорды,https://bcs-express.ru/novosti-i-analitika/gazprom-eksport-prodolzhaet-bit-rekordy
21 июля 2017,"Газпром: Следующая локальная цель – 122,2",https://bcs-express.ru/tehanaliz/gazp/21.07.17
21 июля 2017,"Газпром: Следующая локальная цель – 122,2",https://bcs-express.ru/tehanaliz/gazp/21.07.17
20 июля 2017,Газпром: Идет закрывать ценовой разрыв,https://bcs-express.ru/tehanaliz/gazp/20.07.17
20 июля 2017,Идея в акциях Газпрома успешно реализовалась,https://bcs-express.ru/novosti-i-analitika/ideia-v-aktsiiakh-gazproma-uspeshno-realizovalas
20 июля 2017,Газпром: Идет закрывать ценовой разрыв,https://bcs-express.ru/tehanaliz/gazp/20.07.17
20 июля 2017,Газпром: Идет закрывать ценовой разрыв,https://bcs-express.ru/tehanaliz/gazp/20.07.17
19 июля 2017,Газпром: Попытка сыграть на закрытие гэпа видится вполне вероятной,https://bcs-express.ru/tehanaliz/gazp/19.07.17
19 июля 2017,Газпром: Попытка сыграть на закрытие гэпа видится вполне вероятной,https://bcs-express.ru/tehanaliz/gazp/19.07.17
18 июля 2017,Газпром: Участвуем в закрытии дивидендного гэпа,https://bcs-express.ru/novosti-i-analitika/gazprom-uchastvuem-v-zakrytii-dividendnogo-gepa
18 июля 2017,Газпром: Ожидаемый дивидендный гэп вызывает сомнения в сломе down-тренда,https://bcs-express.ru/tehanaliz/gazp/18.07.17
18 июля 2017,Газпром: Ожидаемый дивидендный гэп вызывает сомнения в сломе down-тренда,https://bcs-express.ru/tehanaliz/gazp/18.07.17
18 июля 2017,Сегодня последний день для получения дивидендов в Алросе и Газпроме,https://bcs-express.ru/novosti-i-analitika/segodnia-poslednii-den-dlia-polucheniia-dividendov-v-alrose-i-gazprome
17 июля 2017,"Сегодня последний день для получения дивидендов в Россетях, ФСК ЕЭС и др.",https://bcs-express.ru/novosti-i-analitika/segodnia-poslednii-den-dlia-polucheniia-dividendov-v-rossetiakh-fsk-ees-i-dr
13 июля 2017,Сколько Европа платит Газпрому?,https://bcs-express.ru/novosti-i-analitika/skol-ko-evropa-platit-gazpromu
12 июля 2017,На чем зарабатывает Газпром?,https://bcs-express.ru/novosti-i-analitika/na-chem-zarabatyvaet-gazprom
5 июля 2017,Видео: Акции Газпрома являются нашим краткосрочным фаворитом,https://bcs-express.ru/novosti-i-analitika/video-aktsii-gazproma-iavliaiutsia-nashim-kratkosrochnym-favoritom
5 июля 2017,Как Трамп может навредить Газпрому?,https://bcs-express.ru/novosti-i-analitika/kak-tramp-mozhet-navredit-gazpromu
3 июля 2017,Газпром откроет трейдинговое подразделение в Санкт-Петербурге,https://bcs-express.ru/novosti-i-analitika/gazprom-otkroet-treidingovoe-podrazdelenie-v-sankt-peterburge
30 июня 2017,"Стокгольмский арбитраж постановил взыскать в пользу Газпрома более $1,7 млрд",https://bcs-express.ru/novosti-i-analitika/stokgol-mskii-arbitrazh-postanovil-vzyskat-v-pol-zu-gazproma-bolee-1-7-mlrd
30 июня 2017,Самое важное с ГОСА Газпрома,https://bcs-express.ru/novosti-i-analitika/samoe-vazhnoe-s-gosa-gazproma
29 июня 2017,Прогнозы и комментарии: Сбербанк и Газпром не догоняют,https://bcs-express.ru/novosti-i-analitika/prognozy-i-kommentarii-sberbank-i-gazprom-ne-dogoniaiut
28 июня 2017,Газпром: Ожидается негативный старт дня,https://bcs-express.ru/tehanaliz/gazp/28.06.17
28 июня 2017,Газпром: Ожидается негативный старт дня,https://bcs-express.ru/tehanaliz/gazp/28.06.17
27 июня 2017,Газпром: Акции сползут еще ниже,https://bcs-express.ru/tehanaliz/gazp/27.06.17
27 июня 2017,Газпром: Акции сползут еще ниже,https://bcs-express.ru/tehanaliz/gazp/27.06.17
26 июня 2017,"Газпром: Если пробьем сопротивление на 121.5, то будет «бычий» импульс",https://bcs-express.ru/tehanaliz/gazp/26.06.17
26 июня 2017,"Газпром: Если пробьем сопротивление на 121.5, то будет «бычий» импульс",https://bcs-express.ru/tehanaliz/gazp/26.06.17
22 июня 2017,"Газпром подтвердил 10% рост EBITDA, ждет сохранения FCF",https://bcs-express.ru/novosti-i-analitika/gazprom-podtverdil-10-rost-ebitda-zhdet-sokhraneniia-fcf
14 июня 2017,Потоки Газпрома. Настоящие и будущие,https://bcs-express.ru/novosti-i-analitika/potoki-gazproma-nastoiashchie-i-budushchie
13 июня 2017,«Недоплаченные» дивиденды «Газпрома» хотят компенсировать налогами,https://bcs-express.ru/novosti-i-analitika/nedoplachennye-dividendy-gazproma-khotiat-kompensirovat-nalogami
5 июня 2017,Добыча Газпрома в мае взлетела более чем на 30%,https://bcs-express.ru/novosti-i-analitika/dobycha-gazproma-v-mae-vzletela-bolee-chem-na-30
1 июня 2017,Видеокомментарий: Присматриваемся к лонгам по НорНикелю и Роснефти,https://bcs-express.ru/novosti-i-analitika/videokommentarii-prismatrivaemsia-k-longam-po-nornikeliu-i-rosnefti
31 мая 2017,Стокгольмский арбитраж поддержал Украину в газовом споре с Россией,https://bcs-express.ru/novosti-i-analitika/stokgol-mskii-arbitrazh-podderzhal-ukrainu-v-gazovom-spore-s-rossiei
31 мая 2017,Чистая прибыль Газпрома снизилась на 8%,https://bcs-express.ru/novosti-i-analitika/chistaia-pribyl-gazproma-snizilas-na-8
24 мая 2017,ТМК выиграла тендер Роснефти на поставку труб,https://bcs-express.ru/novosti-i-analitika/tmk-vyigrala-tender-rosnefti-na-postavku-trub
23 мая 2017,Дивиденды генерирующих компаний Газпрома будут не меньше 25% по МСФО,https://bcs-express.ru/novosti-i-analitika/dividendy-generiruiushchikh-kompanii-gazproma-budut-ne-men-she-25-po-msfo
19 мая 2017,Цена «Газпрома» – 64 рубля,https://bcs-express.ru/novosti-i-analitika/2017709027-tsena-gazproma-64-rublia
19 мая 2017,Завтрак инвестора:Система опубликовала аргументы против претензий Роснефти,https://bcs-express.ru/novosti-i-analitika/zavtrak-investora-sistema-opublikovala-argumenty-protiv-pretenzii-rosnefti
18 мая 2017,Итоги торгов: Реагируем почти исключительно на негатив,https://bcs-express.ru/novosti-i-analitika/itogi-torgov-reagiruem-pochti-iskliuchitel-no-na-negativ
18 мая 2017,"Совет директоров Газпрома рекомендовал выплатить дивиденды 8,04 руб",https://bcs-express.ru/novosti-i-analitika/sovet-direktorov-gazproma-rekomendoval-vyplatit-dividendy-v-8-04-rub
18 мая 2017,Новая углеводородная революция,https://bcs-express.ru/novosti-i-analitika/novaia-uglevodorodnaia-revoliutsiia
18 мая 2017,Акции Газпрома стремительно падают на противоречивой информации о дивидендах,https://bcs-express.ru/novosti-i-analitika/aktsii-gazproma-stremitel-no-padaiut-na-protivorechivoi-informatsii-o-dividendakh
18 мая 2017,Ход торгов: Трамп отправил индекс ММВБ к 1965 пунктам,https://bcs-express.ru/novosti-i-analitika/khod-torgov-tramp-otpravil-indeks-mmvb-k-1965-punktam
17 мая 2017,Ход торгов: Индекс ММВБ погряз в болоте,https://bcs-express.ru/novosti-i-analitika/khod-torgov-indeks-mmvb-pogriaz-v-bolote
16 мая 2017,"Видео: Выделяем акции МТС, Роснефти и ТМК",https://bcs-express.ru/novosti-i-analitika/video-vydeliaem-aktsii-mts-rosnefti-i-tmk
16 мая 2017,Ход торгов: Инвесторы не готовы к активным покупкам,https://bcs-express.ru/novosti-i-analitika/khod-torgov-investory-ne-gotovy-k-aktivnym-pokupkam
16 мая 2017,Завтрак инвестора: Аргументация Роснефти в иске к Системе сомнительна,https://bcs-express.ru/novosti-i-analitika/zavtrak-investora-argumentatsiia-rosnefti-v-iske-k-sisteme-somnitel-na
16 мая 2017,Прогнозы и комментарии: Куча корпоративных событий,https://bcs-express.ru/novosti-i-analitika/prognozy-i-kommentarii-kucha-korporativnykh-sobytii
15 мая 2017,Заседание совета директоров Газпрома по дивидендам перенесено,https://bcs-express.ru/novosti-i-analitika/zasedanie-soveta-direktorov-gazproma-po-dividendam-pereneseno
15 мая 2017,&quot;Газпром&quot; не будет платить по &quot;бумажкам&quot;,https://bcs-express.ru/novosti-i-analitika/gazprom-ne-budet-platit-po-bumazhkam
15 мая 2017,Завтрак инвестора: ФАС предлагает повысить с июля цены на газ Газпрома,https://bcs-express.ru/novosti-i-analitika/zavtrak-investora-fas-predlagaet-povysit-s-iiulia-tseny-na-gaz-gazproma
12 мая 2017,Итоги торгов: Тучи сгущаются,https://bcs-express.ru/novosti-i-analitika/itogi-torgov-tuchi-sgushchaiutsia
12 мая 2017,Газпром: потенциал роста еще не исчерпан,https://bcs-express.ru/novosti-i-analitika/gazprom-potentsial-rosta-eshche-ne-ischerpan
10 мая 2017,"Завтрак инвестора: Чистая прибыль Полюса в I квартале выросла на 36,3%",https://bcs-express.ru/novosti-i-analitika/zavtrak-investora-chistaia-pribyl-poliusa-v-i-kvartale-vyrosla-na-36-3
5 мая 2017,Завтрак инвестора: Газпром и Новатэк могут создать СП,https://bcs-express.ru/novosti-i-analitika/zavtrak-investora-gazprom-i-novatek-mogut-sozdat-sp
3 мая 2017,"Завтрак инвестора: Роснефть и Башнефть требуют 106,6 млрд рублей с Системы",https://bcs-express.ru/novosti-i-analitika/zavtrak-investora-aktsii-sistemy-rukhnuli-na-19
2 мая 2017,Экспорт Газпрома в апреле вырос на 15%,https://bcs-express.ru/novosti-i-analitika/eksport-gazproma-v-aprele-vyros-na-15
28 апреля 2017,"Итоги торгов: 0,5% от ставки, 50% от прибыли госкомпаний",https://bcs-express.ru/novosti-i-analitika/itogi-torgov-0-5-stavki-i-50-pribyli-goskompanii
28 апреля 2017,Видео: Сохраняем рекомендацию покупать бумаги Сбербанка и X5,https://bcs-express.ru/novosti-i-analitika/video-sokhraniaem-rekomendatsiiu-pokupat-bumagi-sberbanka-i-x5
27 апреля 2017,Путин одобрил дивидендную планку для госкомпаний «в основном» в 50%,https://bcs-express.ru/novosti-i-analitika/putin-odobril-dividendnuiu-planku-dlia-goskompanii-v-osnovnom-v-50
27 апреля 2017,Видео: В фокусе внимания инвесторов сейчас три фактора,https://bcs-express.ru/novosti-i-analitika/video-v-fokuse-vnimaniia-investorov-seichas-tri-faktora
27 апреля 2017,Газпром нарастил прибыль в 2016 году на 21%,https://bcs-express.ru/novosti-i-analitika/gazprom-narastil-pribyl-v-2016-godu-na-21
27 апреля 2017,Прогнозы и комментарии: Пять дней роста – отомстили продавцам,https://bcs-express.ru/novosti-i-analitika/prognozy-i-kommentarii-piat-dnei-rosta-otomstili-prodavtsam
26 апреля 2017,Видео: Рекомендуем сосредоточить внимание на дивидендных историях,https://bcs-express.ru/novosti-i-analitika/video-rekomenduem-vnimanie-na-dividendnykh-istoriiakh
26 апреля 2017,Завтрак инвестора: Газпром продолжит транзит газа через Украину после 2019 г.,https://bcs-express.ru/novosti-i-analitika/zavtrak-investora-gazprom-prodolzhit-tranzit-gaza-cherez-ukrainu-posle-2019-g
26 апреля 2017,Прогнозы и комментарии: Индекс ММВБ снова вернулся к 2000,https://bcs-express.ru/novosti-i-analitika/prognozy-i-kommentarii-indeks-mmvb-snova-vernulsia-k-2000
25 апреля 2017,Завтрак инвестора: Правительство добивается от госкомпаний 50% прибыли в форме дивидендов,https://bcs-express.ru/novosti-i-analitika/zavtrak-investora-sovet-direktorov-rosnefti-predlagaet-dividendy-v-5-98-rub-na-aktsiiu
25 апреля 2017,Прогнозы и комментарии: Дивиденды госкомпаний подогрели рынок,https://bcs-express.ru/novosti-i-analitika/prognozy-i-kommentarii-dividendy-goskompanii-podogreli-rynok
25 апреля 2017,Партнеры Газпрома профинансируют Северный поток-2 на 50%,https://bcs-express.ru/novosti-i-analitika/gazprom-profinansiruet-severnyi-potok-2-na-4-75-mlrd-evro
24 апреля 2017,Итоги торгов: Внимание только на позитив,https://bcs-express.ru/novosti-i-analitika/itogi-torgov-vnimanie-tol-ko-na-pozitiv
21 апреля 2017,Росимущество за дивиденды в размере 50% от прибыли госкомпаний,https://bcs-express.ru/novosti-i-analitika/rosimushchestvo-za-dividendy-v-razmere-50-ot-pribyli-goskompanii
19 апреля 2017,Завтрак инвестора: Роснефть предложила ввести отрицательную ставку акциза,https://bcs-express.ru/novosti-i-analitika/zavtrak-investora-rosneft-predlozhila-vvesti-otritsatel-nuiu-stavku-aktsiza
17 апреля 2017,"Газпром с начала года нарастил добычу газа на 12,5% г/г",https://bcs-express.ru/novosti-i-analitika/gazprom-s-nachala-goda-narastil-dobychu-gaza-na-12-5-g-g
14 апреля 2017,Видео: Подтверждаем свои рекомендации продавать Северсталь и покупать Эталон,https://bcs-express.ru/novosti-i-analitika/video-podtverzhdaem-svoi-rekomendatsii-prodavat-severstal-i-pokupat-etalon
13 апреля 2017,"Газпром может выплатить дивиденды в размере 7,89 руб. на акцию",https://bcs-express.ru/novosti-i-analitika/gazprom-mozhet-vyplatit-dividendy-v-razmere-7-89-rub-na-aktsiiu
12 апреля 2017,Видео: Рекомендуем покупать акции Эталон после отчетности,https://bcs-express.ru/novosti-i-analitika/video-rekomenduem-pokupat-aktsii-etalon-posle-otchetnosti
12 апреля 2017,Газпром: Покупка с очень коротким «стопом»,https://bcs-express.ru/novosti-i-analitika/gazprom-pokupka-s-ochen-korotkim-stopom
12 апреля 2017,Завтрак инвестора: Роснефть купила 100% компании Конданефть,https://bcs-express.ru/novosti-i-analitika/zavtrak-investora-rosneft-kupila-100-kompanii-kondaneft
11 апреля 2017,"Роснефтегаз могут обязать поднимать в бюджет дивиденды Роснефти, Газпрома и Интер РАО",https://bcs-express.ru/novosti-i-analitika/rosneftegaz-mogut-obiazat-podnimat-v-biudzhet-dividendy-rosnefti-i-inter-rao
11 апреля 2017,Кто упал сильнее всех?,https://bcs-express.ru/novosti-i-analitika/kto-upal-sil-nee-vsekh
10 апреля 2017,Сможет ли Газпром завоевать азиатский рынок?,https://bcs-express.ru/novosti-i-analitika/smozhet-li-gazprom-zavoevat-aziatskii-rynok
10 апреля 2017,Вот это отставание! Нефтяники не догоняют нефть,https://bcs-express.ru/novosti-i-analitika/vot-eto-otstavanie-neftianiki-ne-dogoniaiut-neft
7 апреля 2017,Завтрак инвестора: Telenor продает 4% акций VEON,https://bcs-express.ru/novosti-i-analitika/zavtrak-investora-telenor-prodaet-4-aktsii-veon
6 апреля 2017,Видео: Предлагаем присмотреться к акциям ТМК,https://bcs-express.ru/novosti-i-analitika/video-predlagaem-prismotret-sia-k-aktsiiam-tmk
6 апреля 2017,Завтрак инвестора: АЛРОСА обсуждает расчёт дивидендов от cash flow,https://bcs-express.ru/novosti-i-analitika/zavtrak-investora-alrosa-obsuzhdaet-raschet-dividendov-ot-cash-flow
4 апреля 2017,Газпром: Импульс с растущими оборотами,https://bcs-express.ru/novosti-i-analitika/gazprom-impul-s-s-rastushchimi-oborotami
30 марта 2017,Чистая прибыль Газпрома по РСБУ за 2016 год выросла на 2%,https://bcs-express.ru/novosti-i-analitika/chistaia-pribyl-gazproma-po-rsbu-za-2016-god-vyrosla-na-2
21 марта 2017,Газпром: Покупаем на выходе из треугольника,https://bcs-express.ru/novosti-i-analitika/gazprom-pokupaem-na-vykhode-iz-treugol-nika
20 марта 2017,Газпром: Все еще ниже 130,https://bcs-express.ru/tehanaliz/gazp/20.03.17
20 марта 2017,Газпром: Все еще ниже 130,https://bcs-express.ru/tehanaliz/gazp/20.03.17
13 марта 2017,Газпром: Попытка отыграть двойное дно,https://bcs-express.ru/novosti-i-analitika/gazprom-popytka-otygrat-dvoinoe-dno
13 марта 2017,"Завтрак инвестора: ТМК увеличил квартальную прибыль в 7,6 раз",https://bcs-express.ru/novosti-i-analitika/zavtrak-investora-tmk-uvelichil-kvartal-nuiu-pribyl-na-15
6 марта 2017,Позитивный фактор для Газпрома,https://bcs-express.ru/novosti-i-analitika/pozitivnyi-faktor-dlia-gazproma
3 марта 2017,Итоги торгов: Удержались от обвала,https://bcs-express.ru/novosti-i-analitika/itogi-torgov-uderzhalis-ot-obvala
2 марта 2017,Видеокомментарий: Рекомендуем продавать ВТБ,https://bcs-express.ru/novosti-i-analitika/videokommentarii-rekomenduem-prodavat-vtb
2 марта 2017,Газпром может оставить дивиденды на уровне 2015 года,https://bcs-express.ru/novosti-i-analitika/gazprom-mozhet-ostavit-dividendy-na-urovne-2015-goda
1 марта 2017,Газпром снижает транзит через Украину,https://bcs-express.ru/novosti-i-analitika/gazprom-snizhaet-tranzit-cherez-ukrainu
28 февраля 2017,«Газпром» повышает стоимость газа для Евросоюза,https://bcs-express.ru/novosti-i-analitika/gazprom-povyshaet-stoimost-gaza-dlia-evrosoiuza
17 февраля 2017,Видео: Потенциал роста акций РусАгро более 50%,https://bcs-express.ru/novosti-i-analitika/video-potentsial-rosta-aktsii-rusagro-bolee-50
17 февраля 2017,Новатэк и Газпром могут создать СП и другие новости,https://bcs-express.ru/novosti-i-analitika/novatek-i-gazprom-mogut-sozdat-spi-drugie-novosti
16 февраля 2017,TCS Group отменила планы по проведению SPO и другие новости,https://bcs-express.ru/novosti-i-analitika/tcs-group-otmenila-plany-po-provedeniiu-spo-i-drugie-novosti
13 февраля 2017,Онэксим может продать 5% UC Rusal в ближайшие дни и другие новости,https://bcs-express.ru/novosti-i-analitika/oneksim-mozhet-prodat-5-uc-rusal-v-blizhaishie-dni-i-drugie-novosti
10 февраля 2017,Прогнозы и комментарии: У нас своя песочница,https://bcs-express.ru/novosti-i-analitika/prognozy-i-kommentarii-u-nas-svoia-pesochnitsa
