Date,Title,URL
25 декабря 2015,Чистая прибыль Газпрома по МСФО за 2015 год составит порядка 500 млрд рублей,https://bcs-express.ru/novosti-i-analitika/chistaia-pribyl-gazproma-po-msfo-za-2015-god-sostavit-poriadka-500-mlrd-rublei
25 декабря 2015,Газпром: Низкая активность мешает реализации целей,https://bcs-express.ru/tehanaliz/gazp/25.12.15
25 декабря 2015,Газпром: Низкая активность мешает реализации целей,https://bcs-express.ru/tehanaliz/gazp/25.12.15
24 декабря 2015,Газпром: Подъем c «двойного дна»,https://bcs-express.ru/tehanaliz/gazp/24.12.15
24 декабря 2015,Газпром: Подъем c «двойного дна»,https://bcs-express.ru/tehanaliz/gazp/24.12.15
23 декабря 2015,Видеокомментарий: Стоит воздержаться от открытия новых спекулятивных позиций,https://bcs-express.ru/novosti-i-analitika/videokommentarii-stoit-vozderzhat-sia-ot-otkrytiia-novykh-spekuliativnykh-pozitsii
23 декабря 2015,Газпром: Отскок от ключевых поддержек,https://bcs-express.ru/tehanaliz/gazp/23.12.15
23 декабря 2015,Газпром: Отскок от ключевых поддержек,https://bcs-express.ru/tehanaliz/gazp/23.12.15
22 декабря 2015,Газпром: Опустились к ключевым уровням поддержки,https://bcs-express.ru/tehanaliz/gazp/22.12.15
22 декабря 2015,Газпром: Опустились к ключевым уровням поддержки,https://bcs-express.ru/tehanaliz/gazp/22.12.15
21 декабря 2015,Газпром: Уверенности в быстром восстановлении нет,https://bcs-express.ru/tehanaliz/gazp/21.12.15
21 декабря 2015,Газпром: Уверенности в быстром восстановлении нет,https://bcs-express.ru/tehanaliz/gazp/21.12.15
11 декабря 2015,ГАЗПРОМ: В области поддержки 130 рублей можно фиксировать прибыль от коротких позиции,https://bcs-express.ru/novosti-i-analitika/gazprom-v-oblasti-podderzhki-130-rublei-mozhno-fiksirovat-pribyl-ot-korotkikh-pozitsii
10 декабря 2015,Завтрак инвестора: Аэрофлот рискует потерять сеть Трансаэро и другие новости этого утра,https://bcs-express.ru/novosti-i-analitika/zavtrak-investora-aeroflot-riskuet-poteriat-set-transaero-i-drugie-novosti-etogo-utra
9 декабря 2015,Завтрак инвестора: Заморозка экспортной пошлины может затронуть и 2017 год и другие новости этого утра,https://bcs-express.ru/novosti-i-analitika/zavtrak-investora-zamorozka-eksportnoi-poshliny-mozhet-zatronut-i-2017-god-i-drugie-novosti-etogo-utra
2 декабря 2015,Завтрак инвестора: Совет директоров Ростелекома 4 декабря рассмотрит вопрос о дивидендной политике и другие новости этого утра,https://bcs-express.ru/novosti-i-analitika/zavtrak-investora-sovet-direktorov-rostelekoma-4-dekabria-rassmotrit-vopros-o-dividendnoi-politike-i-drugie-novosti-etogo-utra
1 декабря 2015,РФ может заморозить Турецкий поток,https://bcs-express.ru/novosti-i-analitika/rf-mozhet-zamorozit-turetskii-potok
27 ноября 2015,Видеокомментарий: Стоит присмотреться к покупке акций МосБиржи на долгосрочную перспективу,https://bcs-express.ru/novosti-i-analitika/videokommentarii-stoit-prismotret-sia-k-pokupke-aktsii-mosbirzhi-na-dolgosrochnuiu-perspektivu
25 ноября 2015,Завтрак инвестора: Строительство Турецкого потока под вопросом и другие новости этого утра,https://bcs-express.ru/novosti-i-analitika/zavtrak-investora-stroitel-stvo-turetskogo-potoka-pod-voprosom-i-drugie-novosti-etogo-utra
23 ноября 2015,Завтрак инвестора: НМТП может выплатить дивиденды за 9 месяцев 2015 года и другие новости этого утра,https://bcs-express.ru/novosti-i-analitika/zavtrak-investora-nmtp-mozhet-vyplatit-dividendy-za-9-mesiatsev-2015-goda-i-drugie-novosti-etogo-utra
20 ноября 2015,ГАЗПРОМ: Покупать сейчас довольно опасно,https://bcs-express.ru/novosti-i-analitika/gazprom-pokupat-seichas-dovol-no-opasno
20 ноября 2015,Газпром: Фиксация прибыли перед выходными,https://bcs-express.ru/tehanaliz/gazp/20.11.15
20 ноября 2015,Газпром: Фиксация прибыли перед выходными,https://bcs-express.ru/tehanaliz/gazp/20.11.15
19 ноября 2015,Газпром: Признаков торможения тенденции пока нет,https://bcs-express.ru/tehanaliz/gazp/19.11.15
19 ноября 2015,Газпром: Признаков торможения тенденции пока нет,https://bcs-express.ru/tehanaliz/gazp/19.11.15
18 ноября 2015,Газпром: Уровень сопротивления не устоял,https://bcs-express.ru/tehanaliz/gazp/18.11.15
18 ноября 2015,Газпром: Уровень сопротивления не устоял,https://bcs-express.ru/tehanaliz/gazp/18.11.15
17 ноября 2015,Газпром: Попробуем еще раз на прочность уровень 139,https://bcs-express.ru/tehanaliz/gazp/17.11.15
17 ноября 2015,Газпром: Попробуем еще раз на прочность уровень 139,https://bcs-express.ru/tehanaliz/gazp/17.11.15
16 ноября 2015,Газпром: Падение продолжается,https://bcs-express.ru/tehanaliz/gazp/16.11.15
16 ноября 2015,Газпром: Падение продолжается,https://bcs-express.ru/tehanaliz/gazp/16.11.15
13 ноября 2015,ГАЗПРОМ: Продолжаем удерживать короткую позицию,https://bcs-express.ru/novosti-i-analitika/gazprom-prodolzhaem-uderzhivat-korotkuiu-pozitsiiu
13 ноября 2015,Завтрак инвестора: MSCI Inc. объявила результаты полугодового пересмотра индексов и другие новости этого утра,https://bcs-express.ru/novosti-i-analitika/zavtrak-investora-msci-inc-obieiavila-rezul-taty-polugodovogo-peresmotra-indeksov-i-drugie-novosti-etogo-utra
12 ноября 2015,Газпром: Трендовая линия поддержки пока медведей не остановила,https://bcs-express.ru/tehanaliz/gazp/12.11.15
12 ноября 2015,Газпром: Трендовая линия поддержки пока медведей не остановила,https://bcs-express.ru/tehanaliz/gazp/12.11.15
10 ноября 2015,Газпром: Медведи могут атаковать трендовую линию поддержки,https://bcs-express.ru/tehanaliz/gazp/10.11.15
10 ноября 2015,Газпром: Медведи могут атаковать трендовую линию поддержки,https://bcs-express.ru/tehanaliz/gazp/10.11.15
9 ноября 2015,Газпром: Уровень 139 был снова пробит. Ждем закрепления ниже,https://bcs-express.ru/tehanaliz/gazp/09.11.15
9 ноября 2015,Газпром: Уровень 139 был снова пробит. Ждем закрепления ниже,https://bcs-express.ru/tehanaliz/gazp/09.11.15
6 ноября 2015,Газпром: Попытались начать коррекцию,https://bcs-express.ru/tehanaliz/gazp/06.11.15
6 ноября 2015,Газпром: Попытались начать коррекцию,https://bcs-express.ru/tehanaliz/gazp/06.11.15
5 ноября 2015,Газпром: Внутри дня не исключена попытка коррекции,https://bcs-express.ru/tehanaliz/gazp/05.11.15
5 ноября 2015,Завтрак инвестора: Газпром нефть хочет получить дополнительные льготы для шельфовых проектов и другие новости этого утра,https://bcs-express.ru/novosti-i-analitika/zavtrak-investora-gazprom-neft-khochet-poluchit-dopolnitel-nye-l-goty-dlia-shel-fovykh-proektov-i-drugie-novosti-etogo-utra
5 ноября 2015,Газпром: Внутри дня не исключена попытка коррекции,https://bcs-express.ru/tehanaliz/gazp/05.11.15
3 ноября 2015,Газпром: Снова проверяет 138-139 рублей в качестве сопротивления,https://bcs-express.ru/tehanaliz/gazp/03.11.15
3 ноября 2015,Завтрак инвестора: Indian oil Corp. рассматривет возможность покупки доли в Ванкоре и другие новости этого утра,https://bcs-express.ru/novosti-i-analitika/zavtrak-investora-indian-oil-corp-rassmatrivet-vozmozhnost-pokupki-doli-v-vankore-i-drugie-novosti-etogo-utra
3 ноября 2015,Газпром: Снова проверяет 138-139 рублей в качестве сопротивления,https://bcs-express.ru/tehanaliz/gazp/03.11.15
3 ноября 2015,Газпром: Снова проверяет 138-139 рублей в качестве сопротивления,https://bcs-express.ru/tehanaliz/gazp/03.11.15
2 ноября 2015,Газпром: Можем пробить линию поддержки,https://bcs-express.ru/tehanaliz/gazp/02.11.15
2 ноября 2015,Газпром: Можем пробить линию поддержки,https://bcs-express.ru/tehanaliz/gazp/02.11.15
30 октября 2015,ГАЗПРОМ: Фиксируем часть прибыли,https://bcs-express.ru/novosti-i-analitika/gazprom-fiksiruem-chast-pribyli
30 октября 2015,Газпром: Оттолкнулись от сопротивления,https://bcs-express.ru/tehanaliz/gazp/30.10.15
30 октября 2015,Газпром: Оттолкнулись от сопротивления,https://bcs-express.ru/tehanaliz/gazp/30.10.15
29 октября 2015,Газпром: Снова проверяем 138 в качестве сопротивления,https://bcs-express.ru/tehanaliz/gazp/29.10.15
29 октября 2015,Газпром: Снова проверяем 138 в качестве сопротивления,https://bcs-express.ru/tehanaliz/gazp/29.10.15
28 октября 2015,ГАЗПРОМ: Отскок от уровня сопротивления,https://bcs-express.ru/novosti-i-analitika/gazprom-otskok-ot-urovnia-soprotivleniia
28 октября 2015,Газпром: Проверяем 138 рублей в качестве сопротивления,https://bcs-express.ru/tehanaliz/gazp/28.10.15
28 октября 2015,Завтрак инвестора: НЛМК собирается выплатить дивиденды за III квартал 2015 года и другие новости этого утра,https://bcs-express.ru/novosti-i-analitika/zavtrak-investora-nlmk-sobiraetsia-vyplatit-dividendy-za-iii-kvartal-2015-goda-i-drugie-novosti-etogo-utra
28 октября 2015,Газпром: Проверяем 138 рублей в качестве сопротивления,https://bcs-express.ru/tehanaliz/gazp/28.10.15
28 октября 2015,Газпром: Проверяем 138 рублей в качестве сопротивления,https://bcs-express.ru/tehanaliz/gazp/28.10.15
27 октября 2015,"Газпром за 26 дней октября увеличил экспорт на 41%, добычу на 7%. Был установлен суточный рекорд!",https://bcs-express.ru/novosti-i-analitika/gazprom-za-26-dnei-oktiabria-uvelichil-eksport-na-41-dobychu-na-7-byl-ustanovlen-sutochnyi-rekord
27 октября 2015,Газпром: Пробили уровень поддержки,https://bcs-express.ru/tehanaliz/gazp/27.10.15
27 октября 2015,Завтрак инвестора: Газпром может получить льготную ставку НДПИ за развитие Сахалин-2 и другие новости этого утра,https://bcs-express.ru/novosti-i-analitika/zavtrak-investora-gazprom-mozhet-poluchit-l-gotnuiu-stavku-ndpi-za-razvitie-sakhalin-2-i-drugie-novosti-etogo-utra
27 октября 2015,Газпром: Пробили уровень поддержки,https://bcs-express.ru/tehanaliz/gazp/27.10.15
26 октября 2015,Газпром: Хуже рынка,https://bcs-express.ru/tehanaliz/gazp/26.10.15
26 октября 2015,Завтрак инвестора: Норникель пополнит бюджет на $200 млн и другие новости этого утра,https://bcs-express.ru/novosti-i-analitika/zavtrak-investora-nornikel-popolnit-biudzhet-na-200-mln-i-drugie-novosti-etogo-utra
26 октября 2015,Газпром: Хуже рынка,https://bcs-express.ru/tehanaliz/gazp/26.10.15
23 октября 2015,ГАЗПРОМ: Нет реакции на позитив из Европы,https://bcs-express.ru/novosti-i-analitika/gazprom-net-reaktsii-na-pozitiv-iz-evropy
23 октября 2015,Газпром: Внешний позитивный фон может оказать поддержку котировкам,https://bcs-express.ru/tehanaliz/gazp/23.10.15
23 октября 2015,Завтрак инвестора: Акционеры Сибири готовы отдать часть своих акций в оплату долга Трансаэро и другие новости этого утра,https://bcs-express.ru/novosti-i-analitika/zavtrak-investora-aktsionery-sibiri-gotovy-otdat-chast-svoikh-aktsii-v-oplatu-dolga-transaero-i-drugie-novosti-etogo-utra
23 октября 2015,Газпром: Внешний позитивный фон может оказать поддержку котировкам,https://bcs-express.ru/tehanaliz/gazp/23.10.15
23 октября 2015,Газпром: Внешний позитивный фон может оказать поддержку котировкам,https://bcs-express.ru/tehanaliz/gazp/23.10.15
22 октября 2015,Сообщение о планах Газпрома провести buyback опровергнуто руководством концерна,https://bcs-express.ru/novosti-i-analitika/soobshchenie-o-planakh-gazproma-provesti-buyback-oprovergnuto-rukovodstvom-kontserna
22 октября 2015,Газпром: Покупатели не оправдали надежд,https://bcs-express.ru/tehanaliz/gazp/22.10.15
22 октября 2015,Газпром собирается провести обратный выкуп ?,https://bcs-express.ru/novosti-i-analitika/gazprom-sobiraetsia-provesti-obratnyi-vykup
22 октября 2015,Газпром: Покупатели не оправдали надежд,https://bcs-express.ru/tehanaliz/gazp/22.10.15
21 октября 2015,"ГАЗПРОМ: Взгляд на перспективу бумаги негативный, но продавать сейчас не очень удобно",https://bcs-express.ru/novosti-i-analitika/gazprom-vzgliad-na-perspektivu-bumagi-negativnyi-no-prodavat-seichas-ne-ochen-udobno
21 октября 2015,Газпром: Внутри дня можно присмотреться к покупкам,https://bcs-express.ru/tehanaliz/gazp/21.10.15
21 октября 2015,Газпром: Внутри дня можно присмотреться к покупкам,https://bcs-express.ru/tehanaliz/gazp/21.10.15
20 октября 2015,"Газпром планирует инвестиции в размере 1,043 трлн рублей в 2015 году",https://bcs-express.ru/novosti-i-analitika/gazprom-planiruet-investitsii-v-razmere-1-043-trln-rublei-v-15-godu
20 октября 2015,Газпром: Предпочтительным направлением динамики остается нисходящее,https://bcs-express.ru/tehanaliz/gazp/20.10.15
20 октября 2015,Газпром: Предпочтительным направлением динамики остается нисходящее,https://bcs-express.ru/tehanaliz/gazp/20.10.15
19 октября 2015,Газпром: Медведи снова доминируют,https://bcs-express.ru/tehanaliz/gazp/19.10.15
19 октября 2015,Завтрак инвестора: MSCI исключил акции Уралкалия из индекса MSCI Russia и другие новости этого утра,https://bcs-express.ru/novosti-i-analitika/zavtrak-investora-msci-iskliuchil-aktsii-uralkaliia-iz-indeksa-msci-russia-i-drugie-novosti-etogo-utra
19 октября 2015,Газпром: Медведи снова доминируют,https://bcs-express.ru/tehanaliz/gazp/19.10.15
16 октября 2015,Видеокомментарий: Индекс ММВБ ушел в красную зону,https://bcs-express.ru/novosti-i-analitika/videokommentarii-indeks-mmvb-ushel-v-krasnuiu-zonu
16 октября 2015,ГАЗПРОМ: Не будем рисковать перед выходными,https://bcs-express.ru/novosti-i-analitika/gazprom-ne-budem-riskovat-pered-vykhodnymi
16 октября 2015,Газпром: Ждем развязки,https://bcs-express.ru/tehanaliz/gazp/16.10.15
16 октября 2015,Газпром: Ждем развязки,https://bcs-express.ru/tehanaliz/gazp/16.10.15
15 октября 2015,Газпром: С открытия еще будет попытка роста,https://bcs-express.ru/tehanaliz/gazp/15.10.15
15 октября 2015,Газпром: С открытия еще будет попытка роста,https://bcs-express.ru/tehanaliz/gazp/15.10.15
14 октября 2015,ГАЗПРОМ: Ждем сигнала к продаже,https://bcs-express.ru/novosti-i-analitika/gazprom-zhdem-signala-k-prodazhe
14 октября 2015,Газпром: Противоречивые факторы заставляют проявить осторожность.,https://bcs-express.ru/tehanaliz/gazp/14.10.15
14 октября 2015,Газпром: Противоречивые факторы заставляют проявить осторожность.,https://bcs-express.ru/tehanaliz/gazp/14.10.15
13 октября 2015,"Газпром: Шанс на возобновление среднесрочной тенденции появился, но разворот пока неубедительный",https://bcs-express.ru/tehanaliz/gazp/13.10.15
13 октября 2015,"Газпром: Шанс на возобновление среднесрочной тенденции появился, но разворот пока неубедительный",https://bcs-express.ru/tehanaliz/gazp/13.10.15
12 октября 2015,Fitch: повышение налогов может заставить российских производителей нефти снижать добычу,https://bcs-express.ru/novosti-i-analitika/fitch-povyshenie-nalogov-mozhet-zastavit-rossiiskikh-proizvoditelei-nefti-snizhat-dobychu
12 октября 2015,"Газпром: Пробили скользящую, ждем подтверждения",https://bcs-express.ru/tehanaliz/gazp/12.10.15
12 октября 2015,Завтрак инвестора: Газпром возобновил поставку газа на Украину и другие новости этого утра,https://bcs-express.ru/novosti-i-analitika/zavtrak-investora-gazprom-vozobnovil-postavku-gaza-na-ukrainu-i-drugie-novosti-etogo-utra
12 октября 2015,"Газпром: Пробили скользящую, ждем подтверждения",https://bcs-express.ru/tehanaliz/gazp/12.10.15
9 октября 2015,ГАЗПРОМ: В любой непонятной ситуации - шорти,https://bcs-express.ru/novosti-i-analitika/gazprom-v-liuboi-neponiatnoi-situatsii-shorti
9 октября 2015,Газпром: Продолжим борьбу за уровень 140,https://bcs-express.ru/tehanaliz/gazp/09.10.15
9 октября 2015,Газпром: Продолжим борьбу за уровень 140,https://bcs-express.ru/tehanaliz/gazp/09.10.15
8 октября 2015,"Газпром размещает евробонды на 1 млрд евро под доходность 4,625%",https://bcs-express.ru/novosti-i-analitika/gazprom-razmeshchaet-evrobondy-na-1-mlrd-evro-pod-dokhodnost-4-625
8 октября 2015,Газпром: Попробуем оттолкнуться от сопротивления,https://bcs-express.ru/tehanaliz/gazp/08.10.15
8 октября 2015,Еврокомисар по энергетики Мигель Ариас Каньете видит угрозу в Северном потоке -2,https://bcs-express.ru/novosti-i-analitika/evrokomisar-po-energetiki-migel-arias-kan-ete-vidit-ugrozu-v-severnom-potoke-2
8 октября 2015,Газпром: Попробуем оттолкнуться от сопротивления,https://bcs-express.ru/tehanaliz/gazp/08.10.15
8 октября 2015,Газпром: Попробуем оттолкнуться от сопротивления,https://bcs-express.ru/tehanaliz/gazp/08.10.15
7 октября 2015,ГАЗПРОМ: Ждем возобновления падения,https://bcs-express.ru/novosti-i-analitika/gazprom-zhdem-vozobnovleniia-padeniia
7 октября 2015,Газпром: Уровень сопротивления уже близко,https://bcs-express.ru/tehanaliz/gazp/07.10.15
7 октября 2015,Завтрак инвестора: Газпром уменьшит вдвое мощность «Турецкого потока» и другие новости этого утра,https://bcs-express.ru/novosti-i-analitika/zavtrak-investora-gazprom-umen-shit-vdvoe-moshchnost-turetskogo-potoka-i-drugie-novosti-etogo-utra
7 октября 2015,Газпром: Уровень сопротивления уже близко,https://bcs-express.ru/tehanaliz/gazp/07.10.15
6 октября 2015,Газпром: Медведи сегодня могут перейти в наступление,https://bcs-express.ru/tehanaliz/gazp/06.10.15
6 октября 2015,Завтрак инвестора: Норвежская Telenor планирует продать долю в компании Vimpelcom и другие новости этого утра,https://bcs-express.ru/novosti-i-analitika/zavtrak-investora-norvezhskaia-telenor-planiruet-prodat-doliu-v-kompanii-vimpelcom-i-drugie-novosti-etogo-utra
6 октября 2015,Газпром: Медведи сегодня могут перейти в наступление,https://bcs-express.ru/tehanaliz/gazp/06.10.15
5 октября 2015,Газпром: Пробили поддержку 132. Ждем проверки,https://bcs-express.ru/tehanaliz/gazp/05.10.15
5 октября 2015,Газпром: Пробили поддержку 132. Ждем проверки,https://bcs-express.ru/tehanaliz/gazp/05.10.15
2 октября 2015,ГАЗПРОМ: Сохраняем негативный взгляд на котировки компании,https://bcs-express.ru/novosti-i-analitika/gazprom-sokhraniaem-negativnyi-vzgliad-na-kotirovki-kompanii
2 октября 2015,Газпром: Поддержка 132 пока актуальна,https://bcs-express.ru/tehanaliz/gazp/02.10.15
2 октября 2015,Газпром: Поддержка 132 пока актуальна,https://bcs-express.ru/tehanaliz/gazp/02.10.15
1 октября 2015,Газпром: Свеча неопределенности с намеком на продолжение отскока,https://bcs-express.ru/tehanaliz/gazp/01.10.15
1 октября 2015,Завтрак инвестора: Структуры С.Керимова выставили оферту акционерам Polyus Gold и другие новости этого утра,https://bcs-express.ru/novosti-i-analitika/zavtrak-investora-struktury-s-kerimova-vystavili-ofertu-aktsioneram-polyus-gold-i-drugie-novosti-etogo-utra
1 октября 2015,Газпром: Свеча неопределенности с намеком на продолжение отскока,https://bcs-express.ru/tehanaliz/gazp/01.10.15
30 сентября 2015,ГАЗПРОМ: Проверяем трендовую линию сопротивления,https://bcs-express.ru/novosti-i-analitika/gazprom-proveriaem-trendovuiu-liniiu-soprotivleniia
30 сентября 2015,Газпром: Продолжаем отскок,https://bcs-express.ru/tehanaliz/gazp/30.09.15
30 сентября 2015,Газпром: Продолжаем отскок,https://bcs-express.ru/tehanaliz/gazp/30.09.15
29 сентября 2015,Газпром: Пробили уровень поддержки. Ждем подтверждения,https://bcs-express.ru/tehanaliz/gazp/29.09.15
29 сентября 2015,Газпром: Пробили уровень поддержки. Ждем подтверждения,https://bcs-express.ru/tehanaliz/gazp/29.09.15
25 сентября 2015,ГАЗПРОМ: Пока взгляд остается негативным,https://bcs-express.ru/novosti-i-analitika/gazprom-poka-vzgliad-ostaetsia-negativnym
25 сентября 2015,Газпром: Акция приблизилась к минимумам года,https://bcs-express.ru/tehanaliz/gazp/25.09.15
