Date,Title,URL
Сегодня в 08:23,Газпром. Пора отскакивать,https://bcs-express.ru/tehanaliz/gazp/15.03.24
Вчера в 09:03,Газпром. У покупателей не хватает сил,https://bcs-express.ru/tehanaliz/gazp/14.03.24
13 марта в 08:49,Газпром. Шансы выхода из боковика вверх растут,https://bcs-express.ru/tehanaliz/gazp/13.03.24
12 марта в 09:11,Газпром. Акции под давлением,https://bcs-express.ru/tehanaliz/gazp/12.03.24
11 марта в 08:42,Газпром. «Пила» продолжается,https://bcs-express.ru/tehanaliz/gazp/11.03.24
7 марта в 08:41,Газпром. Оттолкнулись от поддержки и скользящих средних,https://bcs-express.ru/tehanaliz/gazp/07.03.24
6 марта в 07:57,Газпром. Уровень 161 пока сдерживает продавцов,https://bcs-express.ru/tehanaliz/gazp/06.03.24
5 марта в 08:39,Газпром. Проигнорировали оживление на рынке,https://bcs-express.ru/tehanaliz/gazp/05.03.24
4 марта в 09:01,Газпром. Не смогли закрепиться над сопротивлением,https://bcs-express.ru/tehanaliz/gazp/04.03.24
1 марта в 08:44,Газпром. Потенциал для отскока почти исчерпан,https://bcs-express.ru/tehanaliz/gazp/01.03.24
29 февраля в 08:45,Газпром. Волатильность выросла,https://bcs-express.ru/tehanaliz/gazp/29.02.24
28 февраля в 08:43,Газпром. Риски возобновления спуска,https://bcs-express.ru/tehanaliz/gazp/28.02.24
27 февраля в 08:49,Газпром. Потенциал для отскока еще остается,https://bcs-express.ru/tehanaliz/gazp/27.02.24
26 февраля в 08:39,Газпром. Близко к зоне поддержки,https://bcs-express.ru/tehanaliz/gazp/26.02.24
22 февраля в 08:44,Газпром. Осцилляторы перегреты,https://bcs-express.ru/tehanaliz/gazp/22.02.24
21 февраля в 08:45,Газпром. Сломили поддержку,https://bcs-express.ru/tehanaliz/gazp/21.02.24
20 февраля в 08:56,Газпром. Продавцы усиливают давление на 161 руб.,https://bcs-express.ru/tehanaliz/gazp/20.02.24
19 февраля в 09:12,Газпром. Хороший уровень для остановки,https://bcs-express.ru/tehanaliz/gazp/19.02.24
16 февраля в 08:15,Газпром. Близко к поддержке,https://bcs-express.ru/tehanaliz/gazp/16.02.24
15 февраля в 08:58,Газпром. Медведи не отступают,https://bcs-express.ru/tehanaliz/gazp/15.02.24
14 февраля в 08:54,Газпром. У медведей не все так радужно,https://bcs-express.ru/tehanaliz/gazp/14.02.24
13 февраля в 08:52,Газпром. Минимум сломлен,https://bcs-express.ru/tehanaliz/gazp/13.02.24
12 февраля в 09:03,Газпром. Цель коррекции очень близко,https://bcs-express.ru/tehanaliz/gazp/12.02.24
9 февраля в 08:38,Газпром. Хорошие уровни для отскока,https://bcs-express.ru/tehanaliz/gazp/09.02.24
8 февраля в 08:47,Газпром. Попытка роста не увенчалась успехом,https://bcs-express.ru/tehanaliz/gazp/08.02.24
7 февраля в 09:16,Газпром. Не определились с направлением,https://bcs-express.ru/tehanaliz/gazp/07.02.24
6 февраля в 08:57,Газпром. Импульс снижения остановлен,https://bcs-express.ru/tehanaliz/gazp/06.02.24
5 февраля в 09:12,Газпром. Волатильность на новостях,https://bcs-express.ru/tehanaliz/gazp/05.02.24
2 февраля в 08:25,Газпром. Выросли — откатились,https://bcs-express.ru/tehanaliz/gazp/02.02.24
1 февраля в 08:41,Газпром. Рывок вверх,https://bcs-express.ru/tehanaliz/gazp/01.02.24
31 января в 09:10,Газпром. Остановка падения,https://bcs-express.ru/tehanaliz/gazp/31.01.24
29 января в 09:19,Газпром. Важно удержать ближайшую поддержку,https://bcs-express.ru/tehanaliz/gazp/29.01.24
26 января в 08:57,Газпром. Подошли к важной отметке,https://bcs-express.ru/tehanaliz/gazp/26.01.24
25 января в 07:35,Газпром. Нехороший знак,https://bcs-express.ru/tehanaliz/gazp/25.01.24
24 января в 08:30,Газпром. Очередной импульс роста,https://bcs-express.ru/tehanaliz/gazp/24.01.24
23 января в 08:58,Газпром. Консолидация перед рывком,https://bcs-express.ru/tehanaliz/gazp/23.01.24
22 января в 08:51,Газпром. Передышка на подъеме,https://bcs-express.ru/tehanaliz/gazp/22.01.24
19 января в 08:50,Газпром. Импульс роста,https://bcs-express.ru/tehanaliz/gazp/19.01.24
18 января в 08:52,Газпром. Растущая тенденция в силе,https://bcs-express.ru/tehanaliz/gazp/18.01.24
17 января в 08:35,Газпром. Третье касание,https://bcs-express.ru/tehanaliz/gazp/17.01.24
16 января в 08:49,Газпром. Перерыв на подъеме,https://bcs-express.ru/tehanaliz/gazp/16.01.24
15 января в 08:55,Газпром. Восходящая тенденция в силе,https://bcs-express.ru/tehanaliz/gazp/15.01.24
12 января в 09:00,Газпром. Консолидация над поддержкой,https://bcs-express.ru/tehanaliz/gazp/12.01.24
11 января в 08:50,Газпром. Неубедительно,https://bcs-express.ru/tehanaliz/gazp/11.01.24
10 января в 09:24,Газпром. Тенденция сломлена,https://bcs-express.ru/tehanaliz/gazp/10.01.24
9 января в 08:54,Газпром. В локальном тренде,https://bcs-express.ru/tehanaliz/gazp/09.01.24
3 января в 09:30,Газпром. Цена держится у поддержки,https://bcs-express.ru/tehanaliz/gazp/03.01.24
15 декабря 2023,Газпром. Еще один импульс вниз,https://bcs-express.ru/tehanaliz/gazp/15.12.23
8 декабря 2023,Газпром. Появился повод для оптимизма,https://bcs-express.ru/tehanaliz/gazp/08.12.23
6 декабря 2023,Газпром. Отскок запаздывает,https://bcs-express.ru/tehanaliz/gazp/06.12.23
30 ноября 2023,Газпром. Надежда на отскок не оправдалась,https://bcs-express.ru/tehanaliz/gazp/30.11.23
29 ноября 2023,Газпром. Отскок пока не внушает уверенности,https://bcs-express.ru/tehanaliz/gazp/29.11.23
28 ноября 2023,Переговоры по «Силе Сибири – 2» затягиваются. Что будет с акциями Газпрома,https://bcs-express.ru/novosti-i-analitika/peregovory-po-sile-sibiri-2-zatiagivaiutsia-chto-budet-s-aktsiiami-gazproma
28 ноября 2023,Газпром. Распродажи усиливаются,https://bcs-express.ru/tehanaliz/gazp/28.11.23
27 ноября 2023,Газпром. Уровень 165 теперь в качестве сопротивления,https://bcs-express.ru/tehanaliz/gazp/27.11.23
24 ноября 2023,Газпром. Риски снижения выросли,https://bcs-express.ru/tehanaliz/gazp/24.11.23
23 ноября 2023,Газпром. Фаза накопления близка к завершению,https://bcs-express.ru/tehanaliz/gazp/23.11.23
22 ноября 2023,Газпром. В противофазе к рынку,https://bcs-express.ru/tehanaliz/gazp/22.11.23
21 ноября 2023,5 отстающих акций 2023 года. На какие из них стоит обратить внимание,https://bcs-express.ru/novosti-i-analitika/5-otstaiushchikh-aktsii-2023-goda-na-kakie-iz-nikh-stoit-obratit-vnimanie
21 ноября 2023,Газпром. Шансы на подъем сохраняются,https://bcs-express.ru/tehanaliz/gazp/21.11.23
20 ноября 2023,Газпром. Ложный пробой дает надежду,https://bcs-express.ru/tehanaliz/gazp/20.11.23
17 ноября 2023,Газпром. Удастся ли избежать новых минимумов,https://bcs-express.ru/tehanaliz/gazp/17.11.23
16 ноября 2023,Газпром. В фокусе может быть уровень 165,https://bcs-express.ru/tehanaliz/gazp/16.11.23
15 ноября 2023,Газпром. Надежды на отскок не оправдались,https://bcs-express.ru/tehanaliz/gazp/15.11.23
14 ноября 2023,Газпром. Пружина сжимается,https://bcs-express.ru/tehanaliz/gazp/14.11.23
13 ноября 2023,Газпром. Есть шансы на завершение коррекции,https://bcs-express.ru/tehanaliz/gazp/13.11.23
10 ноября 2023,Газпром. Краткосрочный тренд сломлен,https://bcs-express.ru/tehanaliz/gazp/10.11.23
9 ноября 2023,Газпром. У границы тренда,https://bcs-express.ru/tehanaliz/gazp/09.11.23
8 ноября 2023,Газпром отчитался за III квартал. Резкий рост прибыли — что с ним не так,https://bcs-express.ru/novosti-i-analitika/gazprom-otchitalsia-za-iii-kvartal-rezkii-rost-pribyli-chto-s-nim-ne-tak
8 ноября 2023,Газпром. Слабый сентимент в бумаге,https://bcs-express.ru/tehanaliz/gazp/08.11.23
7 ноября 2023,Газпром. Технический расклад,https://bcs-express.ru/tehanaliz/gazp/07.11.23
2 ноября 2023,Газпром. Акции снова нравятся инвесторам,https://bcs-express.ru/tehanaliz/gazp/02.11.23
1 ноября 2023,Газпром. Неожиданно сильнее рынка,https://bcs-express.ru/tehanaliz/gazp/01.11.23
31 октября 2023,Газпром. Сигналов к развороту не наблюдается,https://bcs-express.ru/tehanaliz/gazp/31.10.23
30 октября 2023,Газпром. Снижение продолжается,https://bcs-express.ru/tehanaliz/gazp/30.10.23
27 октября 2023,Газпром. Продавцы не спешат,https://bcs-express.ru/tehanaliz/gazp/27.10.23
26 октября 2023,Газпром. Котировки ушли под уровень 170,https://bcs-express.ru/tehanaliz/gazp/26.10.23
25 октября 2023,Газпром. Цены на газ не дают повода для оптимизма,https://bcs-express.ru/tehanaliz/gazp/25.10.23
24 октября 2023,Газпром оптимизирует инвестпрограмму. Акции отреагировали ростом,https://bcs-express.ru/novosti-i-analitika/gazprom-optimiziruet-investprogrammu-na-2023-aktsii-otreagirovali-rostom
24 октября 2023,Газпром. Поддержка 170 не вечная,https://bcs-express.ru/tehanaliz/gazp/24.10.23
23 октября 2023,Газпром. Нужны драйверы для роста,https://bcs-express.ru/tehanaliz/gazp/23.10.23
20 октября 2023,Газпром. Покупателям интересны текущие цены,https://bcs-express.ru/tehanaliz/gazp/20.10.23
19 октября 2023,Газпром. Продолжение роста откладывается,https://bcs-express.ru/tehanaliz/gazp/19.10.23
18 октября 2023,Газпром. Уровень 173 сдерживает котировки,https://bcs-express.ru/tehanaliz/gazp/18.10.23
17 октября 2023,Газпром. Акции разгоняются на высоких оборотах,https://bcs-express.ru/tehanaliz/gazp/17.10.23
16 октября 2023,Газпром. Цены на газ поддерживают котировки,https://bcs-express.ru/tehanaliz/gazp/16.10.23
13 октября 2023,Газпром. Вторая попытка преодолеть 170 руб.,https://bcs-express.ru/tehanaliz/gazp/13.10.23
12 октября 2023,Газпром. Поддержка 165 вновь может быть протестирована,https://bcs-express.ru/tehanaliz/gazp/12.10.23
11 октября 2023,Газпром. Формируется разворотная фигура,https://bcs-express.ru/tehanaliz/gazp/11.10.23
10 октября 2023,Газпром. Рост цен на газ может поддержать акции,https://bcs-express.ru/tehanaliz/gazp/10.10.23
9 октября 2023,Газпром. Есть повод для роста,https://bcs-express.ru/tehanaliz/gazp/09.10.23
6 октября 2023,В Австралии вновь забастовки. Газ растет на 5%,https://bcs-express.ru/novosti-i-analitika/v-avstralii-vnov-zabastovki-gaz-rastet-na-5
6 октября 2023,"Газпром. Пружина сжалась, куда дальше",https://bcs-express.ru/tehanaliz/gazp/06.10.23
5 октября 2023,Газпром. Давление на поддержку 165 возрастает,https://bcs-express.ru/tehanaliz/gazp/05.10.23
4 октября 2023,Газпром. Есть надежда на продолжение отскока,https://bcs-express.ru/tehanaliz/gazp/04.10.23
3 октября 2023,Газпром. Хуже рынка,https://bcs-express.ru/tehanaliz/gazp/03.10.23
2 октября 2023,Газпром. Очередной неудавшийся отскок,https://bcs-express.ru/tehanaliz/gazp/02.10.23
29 сентября 2023,Газпром. Долгожданный отскок,https://bcs-express.ru/tehanaliz/gazp/29.09.23
28 сентября 2023,Газпром. Отскок не выходит,https://bcs-express.ru/tehanaliz/gazp/28.09.23
27 сентября 2023,Газпром. Покупатели активны ниже 165,https://bcs-express.ru/tehanaliz/gazp/27.09.23
26 сентября 2023,Газпром. Шансы на отскок снижаются,https://bcs-express.ru/tehanaliz/gazp/26.09.23
25 сентября 2023,Газпром. Покупатели начинают возвращаться,https://bcs-express.ru/tehanaliz/gazp/25.09.23
22 сентября 2023,Газпром. Растеряли рост за 2 месяца,https://bcs-express.ru/tehanaliz/gazp/22.09.23
21 сентября 2023,Газпром. Есть сигналы к росту,https://bcs-express.ru/tehanaliz/gazp/21.09.23
20 сентября 2023,Газпром. Ушли ниже 170 из-за массовых распродаж,https://bcs-express.ru/tehanaliz/gazp/20.09.23
19 сентября 2023,Газпром. Коррекция еще не закончилась,https://bcs-express.ru/tehanaliz/gazp/19.09.23
18 сентября 2023,Газпром. Будет ли отскок,https://bcs-express.ru/tehanaliz/gazp/18.09.23
15 сентября 2023,Газпром. Бумаги под давлением,https://bcs-express.ru/tehanaliz/gazp/15.09.23
14 сентября 2023,Газпром. Надежды на восстановление не оправдались,https://bcs-express.ru/tehanaliz/gazp/14.09.23
13 сентября 2023,Газпром. Вернулись в растущий тренд,https://bcs-express.ru/tehanaliz/gazp/13.09.23
12 сентября 2023,Газпром. Эффект понедельника не помог,https://bcs-express.ru/tehanaliz/gazp/12.09.23
11 сентября 2023,"Газпром. Три дня падения, назревает отскок",https://bcs-express.ru/tehanaliz/gazp/11.09.23
8 сентября 2023,Газпром. Выкупать просадку может быть рано,https://bcs-express.ru/tehanaliz/gazp/08.09.23
7 сентября 2023,Газпром. Подступиться к 185 не удалось,https://bcs-express.ru/tehanaliz/gazp/07.09.23
6 сентября 2023,Газпром. Где следующие цели,https://bcs-express.ru/tehanaliz/gazp/06.09.23
5 сентября 2023,"Газпром. Преодолели 180, что дальше",https://bcs-express.ru/tehanaliz/gazp/05.09.23
4 сентября 2023,Газпром. Копим силы для нового движения,https://bcs-express.ru/tehanaliz/gazp/04.09.23
1 сентября 2023,Газпром. Поддержка 177 остается в силе,https://bcs-express.ru/tehanaliz/gazp/01.09.23
31 августа 2023,Газпром. Рост без продолжения,https://bcs-express.ru/tehanaliz/gazp/31.08.23
30 августа 2023,Газпром. Надежда на дивиденды,https://bcs-express.ru/tehanaliz/gazp/30.08.23
29 августа 2023,Газпром. Растем вместе с рынком,https://bcs-express.ru/tehanaliz/gazp/29.08.23
28 августа 2023,"Газпром. Новая неделя может стартовать в районе 174,5",https://bcs-express.ru/tehanaliz/gazp/28.08.23
25 августа 2023,Газпром. Отскок в рамках консолидации,https://bcs-express.ru/tehanaliz/gazp/25.08.23
24 августа 2023,Газпром. Покупатели могут активизироваться,https://bcs-express.ru/tehanaliz/gazp/24.08.23
23 августа 2023,Газпром. Нашли поддержку,https://bcs-express.ru/tehanaliz/gazp/23.08.23
22 августа 2023,Газпром. Зона 177–178 руб. не поддалась,https://bcs-express.ru/tehanaliz/gazp/22.08.23
21 августа 2023,Газпром. Покупатели взяли инициативу в свои руки,https://bcs-express.ru/tehanaliz/gazp/21.08.23
18 августа 2023,Газпром. Медведи не могут продавить минимум,https://bcs-express.ru/tehanaliz/gazp/18.08.23
17 августа 2023,Газпром. Зона поддержки уже близко,https://bcs-express.ru/tehanaliz/gazp/17.08.23
16 августа 2023,Газпром. Инициатива за продавцами,https://bcs-express.ru/tehanaliz/gazp/16.08.23
15 августа 2023,Газпром. Растеряли дневной рост,https://bcs-express.ru/tehanaliz/gazp/15.08.23
14 августа 2023,Газпром. Откат от 177 руб.,https://bcs-express.ru/tehanaliz/gazp/14.08.23
11 августа 2023,Газпром. Можем обновить майские максимумы,https://bcs-express.ru/tehanaliz/gazp/11.08.23
10 августа 2023,Газпром. Цены на газ поддержали акции,https://bcs-express.ru/tehanaliz/gazp/10.08.23
9 августа 2023,Газпром. Продавцы все еще сильны,https://bcs-express.ru/tehanaliz/gazp/09.08.23
8 августа 2023,Газпром. Техническая картина ухудшается,https://bcs-express.ru/tehanaliz/gazp/08.08.23
7 августа 2023,Газпром. Восходящий тренд под угрозой,https://bcs-express.ru/tehanaliz/gazp/07.08.23
4 августа 2023,Газпром. На пути к 180 благодаря скачку газа,https://bcs-express.ru/tehanaliz/gazp/04.08.23
3 августа 2023,"Газпром. То вверх, то вниз — куда пойдут акции дальше",https://bcs-express.ru/tehanaliz/gazp/03.08.23
2 августа 2023,Газпром. Удержать позиции не удалось,https://bcs-express.ru/tehanaliz/gazp/02.08.23
1 августа 2023,Газпром. Покупатели не сдаются,https://bcs-express.ru/tehanaliz/gazp/01.08.23
31 июля 2023,Газпром. Цены на газ не дают поднять головы,https://bcs-express.ru/tehanaliz/gazp/31.07.23
28 июля 2023,Газпром. Восходящий тренд в силе,https://bcs-express.ru/tehanaliz/gazp/28.07.23
27 июля 2023,Газпром. Куда теперь могут пойти котировки,https://bcs-express.ru/tehanaliz/gazp/27.07.23
26 июля 2023,Газпром. Рыночный оптимизм не помог,https://bcs-express.ru/tehanaliz/gazp/26.07.23
25 июля 2023,Газпром. Попытки роста встречают сильное сопротивление,https://bcs-express.ru/tehanaliz/gazp/25.07.23
24 июля 2023,Газпром. Отскок был ограничен уровнем 172,https://bcs-express.ru/tehanaliz/gazp/24.07.23
20 июля 2023,Газпром. Удержаться в районе 175 не удалось,https://bcs-express.ru/tehanaliz/gazp/20.07.23
19 июля 2023,Газпром. Догоняем рынок,https://bcs-express.ru/tehanaliz/gazp/19.07.23
18 июля 2023,Газпром. Растем вместе с рынком,https://bcs-express.ru/tehanaliz/gazp/18.07.23
17 июля 2023,Газпром. Восходящий тренд продолжается,https://bcs-express.ru/tehanaliz/gazp/17.07.23
14 июля 2023,Газпром. Ралли завершилось,https://bcs-express.ru/tehanaliz/gazp/14.07.23
13 июля 2023,Газпром. Растем против снижения цен на газ,https://bcs-express.ru/tehanaliz/gazp/13.07.23
12 июля 2023,"Газпром. Растем, несмотря на дешевеющий газ",https://bcs-express.ru/tehanaliz/gazp/12.07.23
11 июля 2023,Газпром. Новая попытка роста,https://bcs-express.ru/tehanaliz/gazp/11.07.23
10 июля 2023,Газпром. Что может улучшить техническую картину,https://bcs-express.ru/tehanaliz/gazp/10.07.23
7 июля 2023,Газпром. Продолжится ли отскок,https://bcs-express.ru/tehanaliz/gazp/07.07.23
6 июля 2023,«Народный портфель». Второй месяц подряд слабее рынка,https://bcs-express.ru/novosti-i-analitika/narodnyi-portfel-vtoroi-mesiats-podriad-slabee-rynka
6 июля 2023,Газпром. Есть шансы на отскок,https://bcs-express.ru/tehanaliz/gazp/06.07.23
5 июля 2023,Газпром. Снижение продолжается,https://bcs-express.ru/tehanaliz/gazp/05.07.23
4 июля 2023,"Газпром. Цены на газ разочаровали, обороты снижаются",https://bcs-express.ru/tehanaliz/gazp/04.07.23
3 июля 2023,Газпром. Цены на газ не помогли продолжить рост,https://bcs-express.ru/tehanaliz/gazp/03.07.23
30 июня 2023,Газпром. Закрепиться на 170 с первого раза не удалось,https://bcs-express.ru/tehanaliz/gazp/30.06.23
29 июня 2023,"Газпром. Скачок котировок, как луч надежды",https://bcs-express.ru/tehanaliz/gazp/29.06.23
28 июня 2023,"Газпром. Акции отстают, но еще могут порадовать спекулянтов",https://bcs-express.ru/tehanaliz/gazp/28.06.23
27 июня 2023,Газпром. Попытки роста встречают сопротивление,https://bcs-express.ru/tehanaliz/gazp/27.06.23
26 июня 2023,Газпром. Где может найти поддержку,https://bcs-express.ru/tehanaliz/gazp/26.06.23
23 июня 2023,Газпром. Тренд сломлен,https://bcs-express.ru/tehanaliz/gazp/23.06.23
22 июня 2023,Газпром. Энергии для роста не хватает,https://bcs-express.ru/tehanaliz/gazp/22.06.23
21 июня 2023,Газпром. Копим силы перед движением,https://bcs-express.ru/tehanaliz/gazp/21.06.23
20 июня 2023,Газпром. Тренд все еще смотрит вверх,https://bcs-express.ru/tehanaliz/gazp/20.06.23
19 июня 2023,Газпром. Ложный пробой,https://bcs-express.ru/tehanaliz/gazp/19.06.23
16 июня 2023,Газпром. Где следующие цели,https://bcs-express.ru/tehanaliz/gazp/16.06.23
15 июня 2023,Газпром. Краткосрочно потенциал еще есть,https://bcs-express.ru/tehanaliz/gazp/15.06.23
14 июня 2023,Газпром. Цены на газ дают повод для оптимизма,https://bcs-express.ru/tehanaliz/gazp/14.06.23
13 июня 2023,Газпром. Ложный пробой,https://bcs-express.ru/tehanaliz/gazp/13.06.23
9 июня 2023,Газпром. Удастся ли преодолеть 167,https://bcs-express.ru/tehanaliz/gazp/09.06.23
8 июня 2023,Газпром. Лучше рынка,https://bcs-express.ru/tehanaliz/gazp/08.06.23
7 июня 2023,Газпром. Где может быть справедливый диапазон котировок,https://bcs-express.ru/tehanaliz/gazp/07.06.23
6 июня 2023,Газпром. Цены на газ +20%,https://bcs-express.ru/tehanaliz/gazp/06.06.23
5 июня 2023,Газпром. Еще есть потенциал для снижения,https://bcs-express.ru/tehanaliz/gazp/05.06.23
2 июня 2023,Газпром. Бумаги под давлением,https://bcs-express.ru/tehanaliz/gazp/02.06.23
1 июня 2023,Газпром. Цены на газ дали поддержку,https://bcs-express.ru/tehanaliz/gazp/01.06.23
31 мая 2023,Газпром. Давление на акцию сохраняется,https://bcs-express.ru/tehanaliz/gazp/31.05.23
30 мая 2023,Газпром. Продолжить рост не удалось,https://bcs-express.ru/tehanaliz/gazp/30.05.23
